Number,Id,Title,Upvotes,Upvote Ratio,Comments,Timestamp,Total Votes,Downvotes,Engagement
1,1ahbbp2,Weekly VR - What Did you Play?,3,0.81,19,2024-02-02 19:01:15,3,0,22
2,1amvqvt,Weekly VR - What Did you Play?,3,1.0,7,2024-02-09 19:01:15,3,0,10
3,1aqnapr,Every VR subreddit,185,0.94,34,2024-02-14 13:49:08,196,11,230
4,1aq8eu0,"Mark Zuckerberg on Instagram: ""I tried Vision Pro. Here's my take ...""",445,0.9,437,2024-02-13 23:46:23,494,49,931
5,1aps10e,"These Apple Vision Pro mods are getting wild, this looks like the hololens military edition ",1148,0.92,152,2024-02-13 12:13:41,1247,99,1399
6,1aqqa6o,"Meta gave Max Mustard the greenlight to skip AppLab and launch directly on the store March 21, 24!",4,1.0,2,2024-02-14 15:59:32,4,0,6
7,1aq8bzc,My father is going to pass soon and I want to take some VR footage/spatial video as a memory.,56,0.87,37,2024-02-13 23:43:02,64,8,101
8,1apmcvu,Most breath taking thing I’ve seen done in the meta quest 3,1006,0.94,128,2024-02-13 05:54:17,1070,64,1198
9,1aqp9y6,"You say you like VR and like fighting in PvP, then our game is perfect for you, and we are hosting a tournament RIGHT NOW @ vfcgame.com to learn more",0,0.5,0,2024-02-14 15:17:13,0,0,0
10,1aqp8p0,Star Wars Squadrons is now $1.99! Spoiler: It's worth it!,0,0.5,1,2024-02-14 15:15:42,0,0,1
11,1aqojgl,Wants & Need in a Hypothetical Ideal VR Game Engine,1,1.0,4,2024-02-14 14:45:27,1,0,5
12,1aqi6tj,One week with the Vision Pro,2,0.53,10,2024-02-14 08:31:52,3,1,13
13,1aq2cz1,Opinion: Apple's Persona looks like a hologram you might find on a tombstone.,30,0.64,34,2024-02-13 19:37:36,46,16,80
14,1aql72c,kiwi head strap with headphones,1,0.66,1,2024-02-14 11:57:56,1,0,2
15,1aql3s4,Best cam for vr Videos,1,0.67,4,2024-02-14 11:52:18,1,0,5
16,1apwyz6,I am truly sorry Bruce Lee,38,0.81,9,2024-02-13 16:03:44,46,8,55
17,1aqhqv9,How can I start to be a VR developer in Unity?,1,0.56,8,2024-02-14 08:01:12,1,0,9
18,1aqk9cg,"Different PD per eye, what to choose?",2,0.75,11,2024-02-14 10:59:40,2,0,13
19,1aq86qt,"Having been a DK1 to Quest 3 user, I just tried the AVP and here are my impressions",8,0.62,7,2024-02-13 23:36:50,12,4,19
20,1aq53jx,Exploring a Sinking Titanic 🛳️ in VR! - INSTANT HEART ATTACK! | Quest 3 |,10,0.65,8,2024-02-13 21:28:31,15,5,23
21,1aqnsx0,4070 super not compatible with wmr? is there any way i can bypass this?,0,0.25,3,2024-02-14 14:12:25,0,0,3
22,1aqcssx,Tips for getting good performance with UEVR (game in question Talos Principle 2),4,0.83,3,2024-02-14 03:13:09,4,0,7
23,1aqbtq1,People who own the Quest 3 - how much storage are you using? Is 128GB too little for VR games?,5,0.69,21,2024-02-14 02:24:53,7,2,28
24,1apr9no,Pimax survey reveals the 12K will arrive in Q1 2025! (below the third question),47,0.84,98,2024-02-13 11:28:12,55,8,153
25,1aqfav5,Why dont many headsets use infrared controllers so they can be used in the dark,1,0.54,12,2024-02-14 05:26:09,1,0,13
26,1ap5hfk,"That one ""what headset should I buy?"" guy...",721,0.91,125,2024-02-12 17:27:56,792,71,917
27,1aqeoa1,"At this stage, what's the top recommended headstrap for the budget conscious Quest 3 owner?",1,0.67,7,2024-02-14 04:51:25,1,0,8
28,1apro47,Does anyone remember this headset? (UNAI vr headset),19,0.89,6,2024-02-13 11:52:49,21,2,27
29,1apz9k7,"VR # AVOID - Upcoming physically challenging VR game, Steam page online",6,0.69,9,2024-02-13 17:35:07,8,2,17
30,1apyw6g,How good are steam games on Quest 3?,8,0.75,21,2024-02-13 17:20:18,10,2,31
31,1aqc02e,cheap vr for pc?,2,0.6,21,2024-02-14 02:33:28,3,1,24
32,1apqvf5,"Road Rules 101: Don't Text, Don't Call, and Don't Apple Vision Pro",18,0.75,5,2024-02-13 11:02:33,24,6,29
33,1aq9wl9,Flight Over Skyscraper experience,0,0.33,0,2024-02-14 00:52:48,0,0,0
34,1apblma,AVP Vs Meta Quest 3 Handtracking Test,153,0.82,119,2024-02-12 21:29:52,186,33,305
35,1apt2fm,We're a small indie studio making a new VR game. Help us playtest it!,9,0.91,2,2024-02-13 13:08:40,9,0,11
36,1apm8ip,Streaming with ALVR to Quest 2 across the country,28,0.87,10,2024-02-13 05:47:22,32,4,42
37,1aq2lk7,Traveling with PCVR,2,1.0,5,2024-02-13 19:47:15,2,0,7
38,1aq7dt1,What would you want from a VR Lord of the Rings game?,1,0.56,21,2024-02-13 23:02:42,1,0,22
39,1apvbw6,What are the best VR arcade machines?,4,1.0,5,2024-02-13 14:54:58,4,0,9
40,1apnzk0,We've been working on a Spatial UI Library for the web. Here's what you can do with it.,16,0.94,0,2024-02-13 07:36:40,17,1,17
41,1apnrcq,Why doesn't the beyond VR headset have competition?,17,0.72,50,2024-02-13 07:20:52,23,6,73
42,1aq4emt,Immersion of phone VR.,0,0.5,8,2024-02-13 21:00:29,0,0,8
43,1aq3yf7,"Made a whole account even though i dont use reddit to say this, Arizona Sunshine 2’s quest 3 update is disappointing as hell",0,0.5,5,2024-02-13 20:42:07,0,0,5
44,1aprvz4,Don't miss out PatchWorld weekly workshop Today 7AM PST /4PM CET,3,0.64,2,2024-02-13 12:05:29,4,1,6
45,1apuhuf,Blind people: does VR/AR help you see better?,1,0.51,44,2024-02-13 14:16:36,1,0,45
46,1apxn92,AR device to replace my laptop screen?,1,1.0,2,2024-02-13 16:30:42,1,0,3
47,1aqbb9a,Has VR been underwhelming for a noobie?,0,0.29,16,2024-02-14 02:00:08,0,0,16
48,1aq7316,What vr should I get,0,0.17,11,2024-02-13 22:50:22,0,0,11
49,1apveqb,How to get apps on Lenovo Mirage VR S3,1,0.67,1,2024-02-13 14:58:44,1,0,2
50,1apvdnp,"Jigspace got over 14,000 installs within a week on the Vision Pro",0,0.5,2,2024-02-13 14:57:14,0,0,2
51,1ap798o,See you in 2025,44,0.92,2,2024-02-12 18:38:23,47,3,49
52,1apo4vb,How important is storage space in Meta Quest 3?,3,0.64,10,2024-02-13 07:47:20,4,1,14
53,1aothq9,At last... 1 million members,312,0.93,29,2024-02-12 06:24:18,335,23,364
54,1apyq0r,Virtual Desktop settings recommendations for Quest 3,0,0.25,4,2024-02-13 17:13:29,0,0,4
55,1aq1yq8,Update with my vr title,0,0.38,4,2024-02-13 19:21:25,0,0,4
56,1apt1n8,SteamVR 2.0 Base Station and HTC Vive,0,0.5,6,2024-02-13 13:07:31,0,0,6
57,1apcts9,Micro OLED! What options do we have right now?,13,0.81,44,2024-02-12 22:19:29,16,3,60
58,1aoxr2t,2024 VR hardware releases,83,0.95,97,2024-02-12 11:19:32,87,4,184
59,1aq35s7,Good AR headsets for MacOS,0,0.39,17,2024-02-13 20:09:59,0,0,17
60,1apqhvy,Just watched a cool demo of Vision Pro style immersive videos on my Quest 3,1,0.57,2,2024-02-13 10:37:16,1,0,3
61,1aphcr4,"I really need help.. I don’t know what to do anymore.. my vr “starts up” but it ends with just a black screen in the hmd, and it crashes apps..",5,0.86,3,2024-02-13 01:40:38,5,0,8
62,1ap56hz,"People said Bigscreen Beyond has serious glare. How when compare with Index, or Q2?",22,0.87,54,2024-02-12 17:15:39,25,3,79
63,1apwkg8,ウエスト ワールドの恐ろしい世界 #ホラーゲーム #怖い #metaquest #westworldawakening,0,0.33,0,2024-02-13 15:47:14,0,0,0
64,1ap884y,"Z.O.N.A Project X—PCVR: Continuously improving with your feedback! Added trading, item looting, hunger system, weapon damage visualization, and game optimization. We're always listening!",14,0.85,6,2024-02-12 19:17:15,16,2,22
65,1apeehp,Actually in tears right now,6,0.61,10,2024-02-12 23:25:58,9,3,19
66,1app9ny,Need help finding a new vr,0,0.33,6,2024-02-13 09:09:17,0,0,6
67,1aposzu,Virtual Reality Headset Compare,0,0.5,2,2024-02-13 08:35:50,0,0,2
68,1aposcv,VR Lag issues.,0,0.5,2,2024-02-13 08:34:42,0,0,2
69,1ape3sx,Which PCVR Backrooms game is better to play solo?,6,0.87,1,2024-02-12 23:13:20,6,0,7
70,1ap6drp,Do any of you guys feel one thig holding the industry back is that AVG folks can never get to try/demo VR easily anywhere.,13,0.78,22,2024-02-12 18:03:47,16,3,38
71,1apjk89,(AAA VR) F1 2023 is on 75% discount on Steam,1,0.56,3,2024-02-13 03:26:42,1,0,4
72,1apgpyj,"PC games to VR mods brainstorm / dev suggestions - what would make 1st person mode more ""playable"" for VR modded games that are not normally 1st person?",3,1.0,3,2024-02-13 01:10:42,3,0,6
73,1apnkmd,Virtual Assistant,1,1.0,1,2024-02-13 07:08:18,1,0,2
74,1aqchbf,Zuckerberg hot takes on Vision Pro point by point,0,0.25,27,2024-02-14 02:57:32,0,0,27
75,1apg5d1,User Pimax 5k super or Quest 3?,4,0.75,20,2024-02-13 00:44:07,5,1,25
76,1apu12x,SlimeVR + Freestyle dance = True 🥰💪🤪,0,0.43,3,2024-02-13 13:55:15,0,0,3
77,1apdssm,luke ross AER v2 vs praydogs uevr Which is better??,3,0.71,6,2024-02-12 23:00:34,4,1,10
78,1apbcys,The History of the Future - VR Documentary,4,0.83,2,2024-02-12 21:20:08,4,0,6
79,1ap6lz9,How big is performance hit from VR?,8,0.83,29,2024-02-12 18:12:56,9,1,38
80,1apkrx7,Is it possible to develop apps on both Quest 3 and Apple Vision Pro?,1,0.6,4,2024-02-13 04:28:04,1,0,5
81,1apnwm7,Is the Meta Quest 3 the best thing out there?,0,0.46,28,2024-02-13 07:30:55,0,0,28
82,1apneic,Any way to look at the internet while playing VR without have to pause?,0,0.33,6,2024-02-13 06:57:39,0,0,6
83,1apae3p,Low temperature thermoplastic face head strap?,3,0.81,4,2024-02-12 20:41:49,3,0,7
84,1ap1tvj,Introducing Medicalholodeck AI: Transform DICOM Data with Rapid Auto-Segmentation for Surgical Training and Anatomy Education,7,1.0,5,2024-02-12 14:55:34,7,0,12
85,1apgyot,Upgrading my vr setup,0,0.5,1,2024-02-13 01:22:03,0,0,1
86,1ap290s,We made a web app for virtual avatar content creation. Come try it :),5,0.73,5,2024-02-12 15:14:21,6,1,11
87,1apg5t2,Oculus grip not registering,0,0.5,0,2024-02-13 00:44:39,0,0,0
88,1aos8ed,Big screen beyond worth it over the quest 3?,30,0.77,94,2024-02-12 05:10:52,38,8,132
89,1aop71i,*heavy breathing* Almost... there...,47,0.89,4,2024-02-12 02:21:45,52,5,56
90,1apdrsp,No room customization PCVR passthrough?,0,0.5,1,2024-02-12 22:59:28,0,0,1
91,1aomqq8,How launch,57,0.74,24,2024-02-12 00:13:15,77,20,101
92,1apbv1q,Goovis G3 Max,1,1.0,0,2024-02-12 21:40:26,1,0,1
93,1aowmbk,Anybody remember that guy? :D,7,0.71,3,2024-02-12 10:02:36,9,2,12
94,1apay5l,Looking for VR/AR advertisement,1,1.0,2,2024-02-12 21:03:39,1,0,3
95,1aoq4cm,What headset should I aim towards since WMR is dying?,26,0.87,52,2024-02-12 03:12:56,29,3,81
96,1apabqs,Which VR headset is considered better?,0,0.33,16,2024-02-12 20:39:19,0,0,16
97,1aog3tk,Why amount of discussion about Fov of headsets are low?,101,0.76,157,2024-02-11 19:25:09,132,31,289
98,1aoj23v,3D movies are unexpectedly cool,72,0.81,92,2024-02-11 21:28:45,88,16,180
99,1ap8xw0,"[Academic] Invitation - International research on 360-degree images - São Paulo State University, Brazil (All welcome)",1,1.0,1,2024-02-12 19:45:22,1,0,2
100,1aomf4l,Space Docker VR [Update 1.30 Release Trailer],36,0.97,13,2024-02-11 23:58:00,37,1,50
101,1apludr,Could I make money shooting VR porn with my Quest 3?,0,0.22,7,2024-02-13 05:25:01,0,0,7
102,1ap0lx1,Pimax 5k+ in 2024?,2,0.75,7,2024-02-12 13:58:25,2,0,9
103,1ao90li,Impressions from the PCVR version of Vampire: The Masquerade - Justice. Screenshots taken while playing the game,150,0.93,38,2024-02-11 14:21:26,161,11,199
104,1apgluz,Does your nose hurt with APV? Check out this Extra Band for Vision Pro.,0,0.42,9,2024-02-13 01:05:18,0,0,9
105,1ap5cqd,Viewing 3D/CAD Models in AR or VR,1,1.0,3,2024-02-12 17:22:39,1,0,4
106,1apdlfu,Purchase Advice,0,0.33,4,2024-02-12 22:51:44,0,0,4
107,1ap3zht,Need help! What sensors are present on your headset?,0,0.5,3,2024-02-12 16:28:07,0,0,3
108,1ap3x1l,Original HTC Vive + GTX 970 VS Quest 3 Standalone,0,0.4,7,2024-02-12 16:25:15,0,0,7
109,1ap3sm6,RTX 4090 Quest 2 Settings,0,0.33,4,2024-02-12 16:20:28,0,0,4
110,1aoj2ik,San Andreas VR! Animated cutscenes,30,0.86,5,2024-02-11 21:29:13,34,4,39
111,1aplbkg,Shrek is in Gorilla Tag?!?,0,0.13,2,2024-02-13 04:57:18,0,0,2
112,1ao6j0i,Would you like to have a VR tour of the surgical procedure before the actual surgery?,154,0.85,75,2024-02-11 12:07:14,181,27,256
113,1ap26e3,What are the best smart glasses for gaming?,1,0.6,8,2024-02-12 15:11:08,1,0,9
114,1apijtq,Apple Vision Link | The Dawn of Spatial Experiences,0,0.42,22,2024-02-13 02:38:01,0,0,22
115,1ap6a8a,"Want to try PCVR without spending too much money, should I buy a quest 2 or will a quest 1 suffice?",0,0.5,12,2024-02-12 18:00:13,0,0,12
116,1aozwrf,What first vr should I buy?,0,0.5,28,2024-02-12 13:22:42,0,0,28
117,1aoq7c9,What's some features and designs you would like to see in the upcoming Samsung Mixed Reality Headset? 😎,7,1.0,7,2024-02-12 03:18:02,7,0,14
118,1apkk6c,will there ever be another pcvr headset?,0,0.27,17,2024-02-13 04:16:38,0,0,17
119,1aoza7b,PSVR and Oculus,0,0.4,3,2024-02-12 12:49:59,0,0,3
120,1ap9ra2,I have a Rift S and I'm unhappy about the 80hz. Will a Vive Pro fill my void?,0,0.36,22,2024-02-12 20:16:42,0,0,22
121,1aoyu6h,Looking for VR Gamers,1,0.67,2,2024-02-12 12:24:45,1,0,3
122,1aom6dz,Check out Retropolis dot.Line - our Free-to-Play Mixed Reality game set in the world of Retropolis!,10,0.92,0,2024-02-11 23:45:47,10,0,10
123,1aoxnc6,Modding/upgrading quest 2 cameras for higher res and color,0,0.33,6,2024-02-12 11:12:42,0,0,6
124,1aole1f,Hoping Praydog will make a Silent Hill 2 remake VR mod,9,0.77,9,2024-02-11 23:08:56,11,2,20
125,1ap0zu4,How does ping work in vr,0,0.33,5,2024-02-12 14:16:47,0,0,5
126,1aowigc,Remove unwanted apps and games from Quest 3?,1,0.6,10,2024-02-12 09:55:40,1,0,11
127,1aowef6,How do I get back in my game,1,1.0,1,2024-02-12 09:47:35,1,0,2
128,1aovne2,What we experience shape up who we are. How can we design better social virtual reality experiences?,0,0.5,1,2024-02-12 08:51:51,0,0,1
129,1aovl2n,Can’t move after teleporting in vertigo 2,1,1.0,0,2024-02-12 08:46:50,1,0,1
130,1aovjjn,Built a spatial design library to help designers do faster research and benchmark experiences. Live on Product Hunt now!,1,1.0,1,2024-02-12 08:43:39,1,0,2
131,1aov5g6,"Disable App menu when entering passthrough, Quest 3.",0,0.5,0,2024-02-12 08:15:32,0,0,0
132,1aoupf4,3D Cars in VR?,1,1.0,5,2024-02-12 07:44:15,1,0,6
133,1aoqszr,Any good leg cardio games?,2,0.67,16,2024-02-12 03:53:45,2,0,18
134,1ap5960,Which is the best VR goggles as of today 2024?,0,0.1,14,2024-02-12 17:18:40,0,0,14
135,1ao42fb,You just got pulled into the world of the last VR game you played — how screwed are you?,47,0.74,206,2024-02-11 09:20:14,63,16,269
136,1ap63ic,Helicopter turret game?,0,0.13,1,2024-02-12 17:52:41,0,0,1
137,1aoxsbk,Apple rebranding things to make them seem new and not being completely honest in marketing.,0,0.49,84,2024-02-12 11:21:39,0,0,84
138,1ao9h9n,Will the Reverb G2 V2 work after the WMR removal?,10,0.86,24,2024-02-11 14:43:38,11,1,35
139,1aoldyu,What type of game would you like to see in VR,2,0.63,39,2024-02-11 23:08:52,3,1,42
140,1aoe38i,"Quest 3 at 90hz, X-plane 12/4090 with 13600k (smooth) vs 7800x3d (jerky)",5,0.86,1,2024-02-11 18:00:32,5,0,6
141,1ane87k,Blind guy tries the Apple Vision Pro,1308,0.9,174,2024-02-10 11:23:53,1453,145,1627
142,1ap0x27,Check out my video on the surprising features of the vision pro,0,0.2,1,2024-02-12 14:13:10,0,0,1
143,1aok75s,Is there passthrough games on steamvr ?,2,0.75,12,2024-02-11 22:17:45,2,0,14
144,1aod0lj,Post Spinal Surgery: Any Recs for Consumer-Level VR for Business Productivity?,4,0.84,4,2024-02-11 17:15:03,4,0,8
145,1aogjin,Bonelab & Boneworks campaign mods?,4,0.75,2,2024-02-11 19:43:29,5,1,7
146,1aoan6s,Incoming Windows 11 Update in 2024 will render the HP Reverb G2 Unusable! | What You Need to Know!,5,0.65,0,2024-02-11 15:35:20,7,2,7
147,1ap3np7,With Meta Fans Dominating this Sub - How Trustworthy is Meta Quest Related Information?,0,0.35,42,2024-02-12 16:14:54,0,0,42
148,1aoteai,Potentially buying VR headset.,0,0.2,0,2024-02-12 06:18:29,0,0,0
149,1aobzqz,HP Reverb G2 V2 - Worth it in 2024?,4,0.55,80,2024-02-11 16:32:10,7,3,87
150,1apb1ug,would you consider the VR space dead?,0,0.09,41,2024-02-12 21:07:39,0,0,41
151,1aol47i,Windows 10 WMR,1,0.67,5,2024-02-11 22:57:03,1,0,6
152,1anplqr,AMD is killing it with VR performance.,114,0.78,87,2024-02-10 20:30:07,146,32,233
153,1aoep0x,AR advice,2,0.67,23,2024-02-11 18:25:37,2,0,25
154,1aojwsx,What headset to upgrade to?,0,0.33,8,2024-02-11 22:05:19,0,0,8
155,1aojtil,Queat 3 usbc-Y cable for external headphone and loading at the same time?,0,0.5,0,2024-02-11 22:01:21,0,0,0
156,1aodjmi,Do I need a good PC to run games on the Quest 3?,2,0.63,9,2024-02-11 17:37:34,3,1,12
157,1ao6a6h,Creating a VR streaming platform,5,0.78,10,2024-02-11 11:51:58,6,1,16
158,1ao861m,The importance of develop VR apps,2,0.63,6,2024-02-11 13:39:32,3,1,9
159,1aoa4xr,"Got a Valve index kit + 2 base station + 3 vive trackers 3.0 for 950€, good deal ?",2,0.55,9,2024-02-11 15:12:50,3,1,12
160,1anqwbb,What will the future of VR games be?,46,0.86,59,2024-02-10 21:28:26,53,7,112
161,1aovjte,"Fresnel lenses can melt rocks, so is it possible to fry someone’s eyes with VR goggles?",0,0.15,16,2024-02-12 08:44:17,0,0,16
162,1aod5rk,Skyrim VR MOD recommendations?,0,0.43,5,2024-02-11 17:21:16,0,0,5
163,1aocw5r,How do i play PCVR,1,0.67,4,2024-02-11 17:09:45,1,0,5
164,1an9gbr,Finally got a vision pro.,652,0.93,80,2024-02-10 05:59:08,701,49,781
165,1ao6bw1,Kat Walk C2 Core on the Meta Quest 3 standalone.,2,0.75,1,2024-02-11 11:55:09,2,0,3
166,1aoai92,First VR Headset - What accessories should I get for the Quest 3?,0,0.5,6,2024-02-11 15:29:23,0,0,6
167,1anlhzy,I'm Surprised there arent any good MMORPGs for VR,54,0.76,82,2024-02-10 17:29:49,71,17,153
168,1ao82zx,Finally got my Beyond!,1,0.6,3,2024-02-11 13:35:00,1,0,4
169,1annwdt,"It should’ve been fixed ages ago, don’t think yall care 👀",27,0.72,16,2024-02-10 19:15:24,37,10,53
170,1anyn1n,Pimax 8Kx,3,0.64,8,2024-02-11 03:42:14,4,1,12
171,1ao4by8,Looking for advice on VR headset,0,0.5,6,2024-02-11 09:39:18,0,0,6
172,1ao42r2,Where to buy Vive 3.0 Trackers,1,1.0,4,2024-02-11 09:20:55,1,0,5
173,1ao6yi1,Random price change for quest 3 on Amazon AU,0,0.44,6,2024-02-11 12:33:09,0,0,6
174,1anoxjj,Is VR still good with one (functioning) eye?,10,0.75,16,2024-02-10 20:00:36,13,3,29
175,1aobn6u,Do affordable carpets exists for PCVR ?,0,0.35,9,2024-02-11 16:17:54,0,0,9
176,1ankmst,"ASMR Playground, a Mixed Reality meditation experience with over 10 hours of music, meditations, and teachings. Spawn in dozens of interactable items and work stations anywhere in your VR Space! 100+ ASMR speaker loops and over 25 plants and flowers to build a custom retreat!",13,0.79,5,2024-02-10 16:52:20,16,3,21
177,1any0ud,Is Quest 2 still a good VR headset in 2024?,2,0.6,17,2024-02-11 03:09:13,3,1,20
178,1ao4zw5,Are there any VR apps for iPhone?,0,0.25,1,2024-02-11 10:25:46,0,0,1
179,1anja8i,"Trying to find ""3D"" videos (sbs, with depth), any help?",16,0.94,18,2024-02-10 15:51:06,17,1,35
180,1annp9e,I have a Quest 3. Can I play or do anything with my father who owns an Apple Vision Pro?,8,0.66,12,2024-02-10 19:06:38,12,4,24
181,1ano936,Gmod vr very pixelated?,6,0.72,16,2024-02-10 19:31:16,8,2,24
182,1anlzbg,I love that there’s a place for anyone in VR,9,0.76,4,2024-02-10 17:50:39,11,2,15
183,1amx41x,Christian pastor Mark Driscoll reaction to the Vision Pro is the best so far!!! ,442,0.77,352,2024-02-09 20:00:22,574,132,926
184,1ao2swe,Questions about quest 3.,0,0.25,8,2024-02-11 07:52:24,0,0,8
185,1angxg4,Blueplanet VR v2 - 40 new amazing scenes added to the 50 scenes in the base app - travel the world from home :-),13,0.93,7,2024-02-10 13:59:17,13,0,20
186,1anqwvy,Returning to vr after couple years,3,1.0,13,2024-02-10 21:29:11,3,0,16
187,1anyai8,How good is the eye tracking on Vision Pro and Quest Pro?,2,0.57,13,2024-02-11 03:23:40,3,1,16
188,1anodne,"Visit Madeira - in virtual reality, like you would be there in 360 3D videos of over 70 viewpoints. I as a developer and videographer traveled to Madeira and shot some incredible immersive 360 3D Videos for you to enjoy. Made in Unity, shot with Insta360 Pro 2 camera. Open to reviews and feedback!",3,0.81,3,2024-02-10 19:36:53,3,0,6
189,1ao88t6,Got a HTC Vive for 500$ good deal?,0,0.4,52,2024-02-11 13:43:27,0,0,52
190,1amtaie,The full statement of Ubisoft's CEO,431,0.95,286,2024-02-09 17:17:56,453,22,739
191,1an6qhe,Did anyone ever get ahold of a Gest (as in gesture)?,47,0.88,14,2024-02-10 03:24:25,53,6,67
192,1anglzd,"Just got my Bobo S3 Pro, here are some thoughts (it's good).",6,0.72,23,2024-02-10 13:42:58,8,2,31
193,1anyuq0,VR 360 Skyscraper Roller Coaster Experience,0,0.25,0,2024-02-11 03:54:03,0,0,0
194,1ankons,VR 360 videos with Immersive Sound,3,1.0,0,2024-02-10 16:54:41,3,0,3
195,1amxowz,PSA: Windows Mixed Reality (WMR) headsets no longer work with Windows 11 version 24H2 and newer,129,0.94,89,2024-02-09 20:24:53,137,8,226
196,1an1bhs,Something that i’ve noticed: some people just really don’t wanna talk about the quest 3’s issues and attack others that dare to say that it is not the perfect.,70,0.66,132,2024-02-09 23:01:49,106,36,238
197,1amyqnv,Guilty.,93,0.83,15,2024-02-09 21:09:52,112,19,127
198,1anh4e9,We treated our 2-player asymmetric VR game finally with some ice levels,4,1.0,1,2024-02-10 14:08:05,4,0,5
199,1anr0vy,Had anyone made a augmented hand tracking thing for the Pico?,0,0.4,7,2024-02-10 21:34:10,0,0,7
200,1amkbhv,"Apple won’t let you screen record it, but this is what theater mode looks like in the Vision Pro",757,0.92,341,2024-02-09 09:25:55,822,65,1163
201,1anhwhk,Best price to performance GPU for VR? Where to find VR benchmarks? Lots of questions! (Max budget 1200 euro),4,0.83,19,2024-02-10 14:46:47,4,0,23
202,1antybo,What new tethered options will we see in the next couple of years?,0,0.48,151,2024-02-10 23:45:54,0,0,151
203,1anow6i,Best headset for PCVR under $2k? No sim games,0,0.5,9,2024-02-10 19:59:06,0,0,9
204,1angxz8,"bizarre break, any fixes?",3,1.0,2,2024-02-10 14:00:00,3,0,5
205,1amou4m,Can't think of a better way to watch this movie (besides the actual theater),235,0.83,111,2024-02-09 14:03:01,283,48,394
206,1anmw94,"Really interested to dive in for the first time, which headset is the best for pcvr ?",0,0.4,15,2024-02-10 18:31:04,0,0,15
207,1amyueo,Devs we need a VR hang gliding game,49,0.83,15,2024-02-09 21:14:15,59,10,74
208,1anbqgx,Any PC VR Headsets for $600~ AUD?,6,0.71,15,2024-02-10 08:29:44,8,2,23
209,1anmdzl,Does anybody know why Creed keeps crashing?,1,0.57,10,2024-02-10 18:08:35,1,0,11
210,1anmbh8,Any good (and reasonably cheap) Video Display Glasses?,1,0.6,8,2024-02-10 18:05:26,1,0,9
211,1anvz1w,Status,0,0.25,3,2024-02-11 01:22:06,0,0,3
212,1anlu9x,Is sidequest optimizer a good substitute for QGO,0,0.43,5,2024-02-10 17:44:35,0,0,5
213,1amsxp5,I was so tired to be called a hacker and kicked from many lobbies...so I made a video on How to GIT GUD in VR FPS using Pavlov VR. What do you think?,93,0.8,45,2024-02-09 17:03:40,116,23,161
214,1anlilk,D-Day Enhanced - New Map Launch Event @ 2pm EST | Double XP!,1,1.0,1,2024-02-10 17:30:28,1,0,2
215,1anktp4,"I'm trying to get into PCVR, I have used options which should I choose?",1,0.6,19,2024-02-10 17:00:58,1,0,20
216,1ankqkt,Legendary Tales - Great VR Coop,0,0.5,2,2024-02-10 16:57:08,0,0,2
217,1ao3t2o,Are there any chances of brain damage due to VR use,0,0.19,33,2024-02-11 09:02:26,0,0,33
218,1amv1d4,Sony PSVR2 - Most Underrated VR Headset On The Market? I Think So.,56,0.66,236,2024-02-09 18:30:48,84,28,320
219,1anjwfl,Has anyone got spatial video working yet on the quest 3 who doesn't own any Apple products?,0,0.4,11,2024-02-10 16:18:50,0,0,11
220,1and4ab,HP Reverb G2 vs. the current market (upgrading),3,0.71,27,2024-02-10 10:06:53,4,1,31
221,1anj9cy,"Spacetop, the first AR laptop, is now available in the US! 🥳",1,0.55,2,2024-02-10 15:50:05,1,0,3
222,1anigw9,Flock of the Low God VR：ミステリアスサバイバルホラーゲーム,0,0.4,0,2024-02-10 15:13:44,0,0,0
223,1ansjvk,Phone VR: Back to the future?,0,0.36,16,2024-02-10 22:42:33,0,0,16
224,1an809c,ELI5: base stations/trackers,6,0.72,44,2024-02-10 04:34:59,8,2,52
225,1anz1lo,Valve Index or Quest 3?,0,0.21,24,2024-02-11 04:04:29,0,0,24
226,1angyks,Powerbank for HTC Vive wireless Kit?,0,0.5,3,2024-02-10 14:00:37,0,0,3
227,1anl1nh,Ive seen people talk about quest3 for gaming. What about index from valve? Whats better. The 1000€ index bundle and quest3?,0,0.43,25,2024-02-10 17:10:30,0,0,25
228,1ang3mt,Vision pro 3D scan,0,0.4,1,2024-02-10 13:16:06,0,0,1
229,1anfnos,playing 7k videos on quest 1.,0,0.5,2,2024-02-10 12:51:52,0,0,2
230,1amyzka,Narrative Espionage Thriller Heartshot Reaches PC VR Soon,15,0.91,6,2024-02-09 21:20:12,16,1,22
231,1amy74f,PCVR (SteamVR) VRchat running on Vision Pro wirelessly with index controllers (Using experimental ALVR support),19,0.72,11,2024-02-09 20:46:20,26,7,37
232,1an9f04,Theoretical BSB Eye+Face tracking limitations,3,0.81,3,2024-02-10 05:56:48,3,0,6
233,1amimik,Dude accidentally break his TV while playing VR,186,0.92,46,2024-02-09 07:24:07,202,16,248
234,1am96bb,A Half-Life: Alyx sequel* is in the works,748,0.96,286,2024-02-08 23:10:50,779,31,1065
235,1anyb33,How close are we to a full dive vr?,0,0.1,23,2024-02-11 03:24:34,0,0,23
236,1and8p8,What coating do quest 3/VR headset lenses have?,1,0.67,4,2024-02-10 10:15:32,1,0,5
237,1anlg2y,Vision Pro theater mode and floating movie screens,0,0.33,6,2024-02-10 17:27:29,0,0,6
238,1annzdr,Are WMR headsets just not good for modern PC gaming or is it just my performance?,0,0.18,7,2024-02-10 19:19:06,0,0,7
239,1amz88v,"Not the typical post you see here - but I used UE5 to create a testing tool to assess a user's effective field of vision using VR for the 'patient' and a spectator camera for the 'tester'. Dunno where else to share it, so if you have ideas what to do next with this, let me know.",10,1.0,2,2024-02-09 21:30:43,10,0,12
240,1anbkii,Really hoping for an update from Preydogs RE4VR mod that finally adds first person,1,1.0,0,2024-02-10 08:17:54,1,0,1
241,1anbffg,Anyone Using a Headphone Amp/DAC with Your VR Headset?,1,1.0,0,2024-02-10 08:07:45,1,0,1
242,1anb9k8,Please Suggest me A Good VR under budget!,0,0.43,21,2024-02-10 07:56:32,0,0,21
243,1anny60,Ubisoft backs away from VR after disappointing Assassin's Creed Nexus sales,0,0.27,10,2024-02-10 19:17:36,0,0,10
244,1anantf,viveport question!,1,1.0,2,2024-02-10 07:15:35,1,0,3
