Number,Id,Title,Upvotes,Upvote Ratio,Comments,Timestamp,Total Votes,Downvotes,Engagement
719,1agwn0q,"Palmer Luckey posts comparison of two magazine covers, possibly two defining moments for future VR/MR/Spatial Computing",169,0.82,71,2024-02-02 05:50:59,206,37,277
720,1ahrwq2,Router settings,1,1.0,10,2024-02-03 08:59:20,1,0,11
721,1ah5yyi,A Tale of Two Subreddits: Optimism in r/VisionPro vs. Cynicism in r/VirtualReality,25,0.6,121,2024-02-02 15:12:56,41,16,162
722,1ahb8x1,"Quest 3 users that have not used pancake lens headsets before, have the pancake lenses lived up to the hype for you?",13,0.68,57,2024-02-02 18:58:15,19,6,76
723,1aibjmh,Meta will lose market share if they continue current direction,0,0.14,35,2024-02-04 01:08:13,0,0,35
724,1ahd4bq,"This is the sign you've been waiting for; GET UNDERDOGS VR, to me it's already VR GOTY",8,0.62,12,2024-02-02 20:18:00,12,4,24
725,1agsaau,Quest 3 / Vision Pro true size comparison,274,0.89,219,2024-02-02 01:59:10,307,33,526
726,1ai5uc0,Do you guys like sadlyitsbradley?,0,0.35,27,2024-02-03 20:49:58,0,0,27
727,1ahy39z,Apple Vision Pro Durability Test,0,0.38,0,2024-02-03 15:05:15,0,0,0
728,1ahv10j,Pico 4 vs quest pro which better?,0,0.17,19,2024-02-03 12:27:32,0,0,19
729,1ahll3n,"Trying out the New Wordle and Crossword Inspired MR Game, Wordomi | Gameplay",2,0.6,0,2024-02-03 02:41:30,3,1,3
730,1ah4od8,Spatial video playback support on QuestOS v62,19,0.88,12,2024-02-02 14:16:15,21,2,33
731,1ai1179,why is no one making cheap pcvr?,0,0.36,36,2024-02-03 17:16:58,0,0,36
732,1ahvvuu,Apple Vision Pro vs Meta Quest 3: Key Differences Explained,0,0.44,7,2024-02-03 13:16:19,0,0,7
733,1agu539,Why Aren't More People Into VR Gaming?,112,0.86,353,2024-02-02 03:31:14,130,18,483
734,1ah9hk2,NEW UPCOMING VR FITNESS GAME,9,0.84,4,2024-02-02 17:43:57,10,1,14
735,1ahizav,Extreme Frameloss with good Hardware in VR Mode on decent Games/Resolution,2,1.0,7,2024-02-03 00:31:13,2,0,9
736,1agxuyb,Steam VR Hardware Survey: January 2024,51,0.97,14,2024-02-02 07:07:57,52,1,66
737,1ahu98l,"Compiled all interesting use cases of Vision Pro from Twitter, Reddit etc.",0,0.36,2,2024-02-03 11:38:56,0,0,2
738,1ahb8w9,Exit Suit Plans Opensourced,5,0.86,1,2024-02-02 18:58:14,5,0,6
739,1ahbuza,Pc shutdown everytime i play pcvr games like half life alyx and blade and sorcery,4,1.0,4,2024-02-02 19:23:52,4,0,8
740,1ah9y1p,Is this as cool as it sounds?,6,0.75,1,2024-02-02 18:02:50,8,2,9
741,1ah408c,Apple Vision Pro demo,11,0.62,1,2024-02-02 13:45:01,17,6,18
742,1ah3z12,"Meta Quest v62 Update: Spatial Video Playback, Gamepad Support for Meta Quest Browser, and More",10,0.82,3,2024-02-02 13:43:22,12,2,15
743,1ahc17p,Is the Apple Vision Pro really that revolutionary? This feels like the invention of the Segway. What am I missing?,4,0.53,73,2024-02-02 19:31:15,7,3,80
744,1agd9qd,Revolutionary,483,0.88,244,2024-02-01 15:14:24,548,65,792
745,1ahj7ce,Possibilities of the environments feature of the Apple Vision Pro,1,0.57,14,2024-02-03 00:41:57,1,0,15
746,1agid4j,The future of controllerless gaming!,237,0.9,80,2024-02-01 18:49:46,263,26,343
747,1agiwtz,Synth Riders is getting a day one port to the vision pro (gameplay vision 👇) ,210,0.9,58,2024-02-01 19:11:49,233,23,291
748,1ah1exl,Why majority are not excited for Visor 4K or talk about it?,8,0.59,64,2024-02-02 11:19:38,13,5,77
749,1ah97v0,Did someone already compared vision pro passthrough quality to varjo xr3 /4 ?,3,0.8,7,2024-02-02 17:32:32,3,0,10
750,1ahhlrd,Sync Video between friends,1,1.0,2,2024-02-02 23:29:11,1,0,3
751,1ahghf4,DJI Integra Video input,1,1.0,1,2024-02-02 22:40:56,1,0,2
752,1ahpa69,"Pimax Crystal vs Vision Pro, comparison in cold and objective numbers",0,0.39,25,2024-02-03 06:04:45,0,0,25
753,1aher8d,Saints And Sinners chapter 2 Virtual Desktop fix? Any ideas?,1,1.0,0,2024-02-02 21:27:08,1,0,1
754,1ahjpd3,"Quest 3 makes my eyes feel itchy and irritated within about 10 minutes, quest 2, quest 1, and PSVR1 didn’t, what’s the deal?",0,0.29,7,2024-02-03 01:06:07,0,0,7
755,1agiyy0,"Meta has finally listened and updated Quest Link on V62. RTX 4000 Series cards are now supported and it now works with 120HZ, plus other improvements and changes to make Quest Link better (Look at the patch notes to see em). I’m glad Meta actually cared enough to make PCVR actually better!",113,0.96,78,2024-02-01 19:14:19,117,4,195
756,1agbw6x,Vacuuming - Gamified Edition,254,0.9,36,2024-02-01 14:12:07,282,28,318
757,1ahb3r1,Is a headset that uses a PC/dedicated system to stream to the device possible?,2,0.62,13,2024-02-02 18:51:56,3,1,16
758,1aha21s,Could i sell my Rift S to buy a newer headset?,0,0.5,4,2024-02-02 18:07:30,0,0,4
759,1ah9y65,When is the fabled Valve Deckard coming to us? Guess,1,0.53,19,2024-02-02 18:02:59,1,0,20
760,1ah4cni,Is steam link enough?,2,0.63,13,2024-02-02 14:01:16,3,1,16
761,1agnxr8,Brian Tong says VR180 videos made by Apple are in HDR (High Dynamic Range). Isn't that a first for VR180?,33,0.73,43,2024-02-01 22:42:31,45,12,88
762,1ah8wfm,I killed my Hawk..,0,0.5,6,2024-02-02 17:19:02,0,0,6
763,1aggeca,I bought a $5 USB pedal to play drums in VR and it works,69,0.94,9,2024-02-01 17:27:06,73,4,82
764,1ah7fp2,Roger Lannes de Montebello: A 40-Year Quest for 3-D Photography,1,0.67,1,2024-02-02 16:17:39,1,0,2
765,1agq0t4,Vive Ultimate Trackers Now Have Beta Support For PC VR,20,0.95,17,2024-02-02 00:12:18,21,1,38
766,1ahog3e,Should I take Brad first impressions seriously or is he Biased?,0,0.37,82,2024-02-03 05:16:02,0,0,82
767,1ahhz34,Meta quest without account.,0,0.36,26,2024-02-02 23:45:16,0,0,26
768,1agl1hc,The AVP battery cable is removable afterall.,31,0.71,72,2024-02-01 20:40:49,43,12,115
769,1ah5jcd,Trying to find a good Quest 3 gun stock for Clay Hunt that doesn't cost hundreds of dollars. Anyone try the Featherlight Max?,1,0.67,1,2024-02-02 14:53:54,1,0,2
770,1ah5260,Payments in VR,1,0.67,9,2024-02-02 14:33:20,1,0,10
771,1ah4lpk,Is there any reason to have a hard shell facial interface anymore?,1,0.6,1,2024-02-02 14:12:40,1,0,2
772,1ahcp0r,This CANT be IT! | Lethal Company Vr #4,0,0.4,1,2024-02-02 19:59:57,0,0,1
773,1agdx9a,Watch till the end 🐄 art by VRMistkinya,62,0.91,9,2024-02-01 15:43:22,68,6,77
774,1ah3ruy,Feel the Magic of VR with VUZ: The Premier Live 360 App for iPhone,1,1.0,1,2024-02-02 13:33:45,1,0,2
775,1ah3lu7,an electric precision puzzle platformer (ArcSine Demo Review),0,0.5,1,2024-02-02 13:25:26,0,0,1
776,1agzyt7,EARTH DEFENSE FORCE: IRON RAIN | praydog UEVR |,3,0.67,0,2024-02-02 09:39:29,4,1,4
777,1ah2sp3,So where are the Personna eye stickers for Quest 3?,0,0.5,0,2024-02-02 12:43:28,0,0,0
778,1ah2rtq,Was looking around and found a vive pro 1 full kit with base stations and controllers for 750 aud is it worth it?,0,0.33,10,2024-02-02 12:42:08,0,0,10
779,1ah28t1,Tired legs,1,0.6,14,2024-02-02 12:11:33,1,0,15
780,1ah1u93,Is this the best I can get it?,0,0.5,44,2024-02-02 11:47:11,0,0,44
781,1agfr14,Turning concept arts into VR environments,30,0.97,2,2024-02-01 17:00:34,30,0,32
782,1ah5shz,Quest 3 or Pico 4?,0,0.38,15,2024-02-02 15:05:01,0,0,15
783,1agsurl,Q3 is now the #3 headset on SteamVR,5,0.69,4,2024-02-02 02:26:25,7,2,11
784,1ah0vjq,What is a good alternative to fullbody tracking with PCVR?,0,0.5,11,2024-02-02 10:44:01,0,0,11
785,1agjux3,Rogue Stargun - VR Starfighter Sim for the Quest Releases Today on Applab!,15,0.95,1,2024-02-01 19:51:56,15,0,16
786,1agiuc2,Virtual Hunter - Lovna Dolina Reserve Rework Coming Soon!,15,0.86,16,2024-02-01 19:08:57,17,2,33
787,1agzb4t,I Have a very unique question on Vacation Simulator. I Spoiler tagged this just incase.,1,1.0,0,2024-02-02 08:51:41,1,0,1
788,1agl1eg,"""plasticky"" graphics through the lens even for games that try to emulate ""real world"" look",9,0.85,13,2024-02-01 20:40:43,10,1,23
789,1ah8jsr,What QuestOS would like if Apple made it...,0,0.38,0,2024-02-02 17:04:08,0,0,0
790,1afuqvo,Metro Awakening | Announce Trailer | Meta Quest + PS VR2 + Steam VR,437,0.97,228,2024-01-31 22:29:18,450,13,678
791,1agb69n,Have you got the chance to play the Far cry VR mod ?,22,0.9,13,2024-02-01 13:37:28,24,2,37
792,1agh912,An early look at Apple spatial video playback on Meta Quest via Mark Zuckerberg's Instagram channel.,9,0.74,14,2024-02-01 18:03:09,12,3,26
793,1agiayt,What do I get with bigscreen beyond for full body tracking?,8,0.9,9,2024-02-01 18:47:16,8,0,17
794,1agjyxz,How do you get the centre screw out? Anyone else found it to be tight?,6,0.69,10,2024-02-01 19:56:38,8,2,18
795,1agl0l2,Legendary Tales 1.0 (and PSVR2) Reveal trailer,7,0.89,8,2024-02-01 20:39:49,7,0,15
796,1aguvud,Does anyone use OpenVR Input Emulator for SteamVR ?,1,1.0,0,2024-02-02 04:11:32,1,0,1
797,1agukmh,Whats better for wired pcvr the og htc vive or the meta quest 2,0,0.4,12,2024-02-02 03:54:35,0,0,12
798,1agprd4,Tundra Trackers available on EOZ :),2,1.0,0,2024-02-02 00:01:00,2,0,2
799,1ag7yjd,AVP?,19,0.71,23,2024-02-01 10:28:52,26,7,49
800,1agh6m7,HOLY LIVING,6,0.58,3,2024-02-01 18:00:32,10,4,13
801,1ah4y7d,Meta Quest 3 rushes spatial video support to take on Apple Vision Pro,0,0.33,6,2024-02-02 14:28:40,0,0,6
802,1afvxk3,Metro Awakening VR available for wishlist on Steam Store,150,0.95,36,2024-01-31 23:18:46,157,7,193
803,1agdl4o,"Trailer for upcoming VR game Rock and Roots, coming to STEAM",7,0.82,0,2024-02-01 15:28:26,8,1,8
804,1agddjd,Livestream mocap saved in unity for VR Dating sim game,7,0.89,1,2024-02-01 15:19:07,7,0,8
805,1agn0c2,Q2 vs Q3 for best wireless PCVR experience,2,0.67,16,2024-02-01 22:03:44,2,0,18
806,1agy9xm,Make High Contrast LCD VR Headsets?,0,0.17,11,2024-02-02 07:37:01,0,0,11
807,1agqvw6,Should I buy my friends vive cosmos elite + index controllers for $400? is this a good deal?,1,0.56,13,2024-02-02 00:51:59,1,0,14
808,1ag3tvj,Super Excited for AppleVisionPro but lets not forget that Quest 3 has some Spatial Computing & Spatial Entertainment right now!,31,0.63,43,2024-02-01 05:45:51,49,18,92
809,1afuow2,I did it. I got a room for VR,114,0.96,27,2024-01-31 22:26:59,118,4,145
810,1agaof5,Is there a way to record VR game gameplay in 3D?,6,1.0,6,2024-02-01 13:12:22,6,0,12
811,1agn4g1,Pcvr & quest 3 / PSVR2,0,0.5,6,2024-02-01 22:08:34,0,0,6
812,1agn1mq,Android help,1,1.0,3,2024-02-01 22:05:12,1,0,4
813,1agmxqd,Upgrading Reverb G2 to Quest 3?,1,0.6,3,2024-02-01 22:00:48,1,0,4
814,1afd1al,Expectation vs. Reality (AVP EyeSight),962,0.92,333,2024-01-31 08:17:24,1045,83,1378
815,1afvm3i,"Well, looks like today's announcement has clarified the Paradox of Hope situation, hasn't it? Anyway, take a look at this cozy campfire by the entrance to the anomaly zone in my new game - CONVRGENCE.",60,0.93,15,2024-01-31 23:05:17,64,4,79
816,1aglnxc,They should make a Star Wars game where you deflect blaster bolts,0,0.47,27,2024-02-01 21:06:49,0,0,27
817,1agllhw,Our physics-driven superhero sandbox Demigod just hit 1.0 on Quest!,1,0.6,0,2024-02-01 21:03:51,1,0,1
818,1agfvqx,Missed opportunity in VR gaming?,3,0.67,20,2024-02-01 17:05:44,4,1,24
819,1afz27p,Bigscreen Beyond - Dodging request for refund,35,0.83,38,2024-02-01 01:40:36,42,7,80
820,1agf617,Do you think the Immersed Visor is a scam ?,2,0.56,35,2024-02-01 16:36:22,3,1,38
821,1agez9n,Questions on 1st pc vr setup.,2,0.75,12,2024-02-01 16:28:26,2,0,14
822,1agyhgh,Vision Pro is like PDA in its time,0,0.32,18,2024-02-02 07:52:01,0,0,18
823,1agj896,Our physics-driven superhero simulator Demigod just hit 1.0 on Meta Quest and SteamVR!,1,1.0,1,2024-02-01 19:25:08,1,0,2
824,1agj0ke,Death Horizon: Reloaded | MIXED REALITY UPDATE | Meta Quest 2 (Pro) + Meta Quest 3,0,0.5,1,2024-02-01 19:16:17,0,0,1
825,1afjs00,MKBHD: Using Apple Vision Pro: What It’s Actually Like!,168,0.88,215,2024-01-31 15:00:32,190,22,405
826,1agcfuz,Mario 64 UEVR Mixed Reality Gameplay & Guide,3,0.71,0,2024-02-01 14:36:38,4,1,4
827,1afwr5e,Just as expected: Quest 2 by far the most popular headset,22,0.7,46,2024-01-31 23:54:01,31,9,77
828,1afpm98,Is this good for VR motion sickness?,60,0.83,64,2024-01-31 19:01:53,72,12,136
829,1afvfjj,Jesus I knew my eyes were close but damn. Am I cooked?,27,0.92,7,2024-01-31 22:57:55,29,2,36
830,1ag2z4w,Are bhaptics stuff worth it ?,8,0.91,7,2024-02-01 04:57:59,8,0,15
831,1agolsp,Meta headsets sales down 40% in 2023.,0,0.47,34,2024-02-01 23:10:32,0,0,34
832,1ag8h3c,Contractors montage,2,0.6,2,2024-02-01 11:03:11,3,1,5
833,1agks6e,Quest 3 - Kobra VR Blitzer Gunstock Review & Setup Guide,0,0.2,0,2024-02-01 20:30:03,0,0,0
834,1agbzvo,Just wanted to check if this odd text effect was normal on quest 3.,0,0.5,2,2024-02-01 14:16:55,0,0,2
835,1afuxng,Legendary Tales - 1.0 Release on Feb 8th,18,0.95,4,2024-01-31 22:36:55,18,0,22
836,1agbbw8,Subnautica Below Zero: SubmersedVR Mod Performance Question,0,0.5,3,2024-02-01 13:45:31,0,0,3
837,1agpjss,"Unveiling the Apple $3,500 Vision Pro Headset: Is It Worth the Hype?",0,0.31,1,2024-02-01 23:51:44,0,0,1
838,1afbh4a,Watching 5 NBA Games Simultaneously Using Apple Vision Pro,267,0.76,219,2024-01-31 06:36:26,351,84,570
839,1ag9xur,"Are these specs good? GTX 1080, i5 6600k, 16gb of ddr4 ram.",0,0.5,15,2024-02-01 12:32:52,0,0,15
840,1afjbl6,Full Facetime persona call with Brian Tong.,56,0.83,49,2024-01-31 14:39:41,67,11,116
841,1ag9t4x,SteamVR dashboard causes extreme lag upon opening.,1,1.0,3,2024-02-01 12:25:35,1,0,4
842,1afrakw,VR Accessibility and Performance / Blind In One Eye - Am I Doomed To Always Have A Substandard Experience?,17,0.87,8,2024-01-31 20:09:41,19,2,27
843,1ag09gq,VR / AR for Work and Productivity,6,1.0,1,2024-02-01 02:38:23,6,0,7
844,1ag1gb1,Games that make you sweat without feeling like exercise games. Think pistol whip and Until you fall,4,0.75,37,2024-02-01 03:37:26,5,1,42
845,1afqfxw,"How would an Underwater Sky look like? 🐠 We just launched a new platform experience on Meta Quest via App Lab, Sky Climb! What do you guys think about it?",17,0.9,1,2024-01-31 19:35:12,18,1,19
846,1afl6k1,"In the verge’s most recent Apple review, he said AR/VR with video passthrough is a dead end and optical is the only way, thoughts?",30,0.69,112,2024-01-31 16:01:47,43,13,155
847,1agh74x,You'll find out...,0,0.33,1,2024-02-01 18:01:03,0,0,1
848,1ag7gzk,VR flat gaming advice,1,1.0,3,2024-02-01 09:53:37,1,0,4
849,1ag45ef,Picked up a new G2 V2 for 200$,2,0.63,6,2024-02-01 06:04:21,3,1,9
850,1afpcw5,Microsoft Teams available on Apple Vision Pro on February 2 - MS Teams Blog,11,0.82,4,2024-01-31 18:51:48,13,2,17
851,1afzc4c,Dongle for earbuds drains battery when not in use.,3,1.0,15,2024-02-01 01:54:05,3,0,18
852,1agldnq,The most remarkable thing about the AVP is what they don't talk about in the reviews.,0,0.36,20,2024-02-01 20:55:07,0,0,20
853,1afnl82,AVP biggest feature is ... a Multi-Monitor setup,11,0.58,68,2024-01-31 17:40:46,18,7,86
854,1ag4hhr,[Update] Darksword Battle Eternity Season 2 Begins!,0,0.5,0,2024-02-01 06:24:40,0,0,0
855,1ag3ue3,Vision Pro or AR Foundation,0,0.4,5,2024-02-01 05:46:48,0,0,5
856,1afrd9a,Super 1-1 Challenge + UEVR,5,0.86,2,2024-01-31 20:12:38,5,0,7
857,1afqf6j,Playstation State of Play starts in 2 hours (Metro VR game reveal according to leaks and more),6,0.8,1,2024-01-31 19:34:24,7,1,8
858,1ag1gcz,Motherboard and CPU?,1,1.0,5,2024-02-01 03:37:32,1,0,6
859,1afl64y,MKBHD Vision Pro Review,6,0.58,2,2024-01-31 16:01:18,10,4,12
860,1afl85a,"Full FaceTime call with Vision Pro - Tong, Justine, MKBHD",7,0.65,12,2024-01-31 16:03:42,10,3,22
861,1ag08kc,custom virtual display occulus quest 3,0,0.5,6,2024-02-01 02:37:10,0,0,6
862,1afzuls,Quest 2 vs Quest 3 Field of View,0,0.4,5,2024-02-01 02:18:47,0,0,5
863,1afzhtz,VR 360 Skyscraper Roller Coaster Experience _04 |4K|,0,0.5,0,2024-02-01 02:01:44,0,0,0
864,1afr19p,Is it possible to slave mouse aim in a video game to the center of my sight?,3,0.71,7,2024-01-31 19:59:46,4,1,11
865,1afzecb,Smashbox Arena,1,1.0,4,2024-02-01 01:57:13,1,0,5
866,1agagsv,Is Aurora R16 (RTX 4090 and i14900KF) with 64GB RAM capable enough?,0,0.1,7,2024-02-01 13:01:23,0,0,7
867,1ag5l9o,LastPass on Quest3,0,0.14,2,2024-02-01 07:39:25,0,0,2
868,1aexzlt,Verge review confirms many of the pre-launch issues suspected regarding the Vision Pro,229,0.86,367,2024-01-30 20:10:31,266,37,633
869,1af3za7,The Verge's 1 hour Vergecast Review of Vision Pro is infinitely more fun and detailed than the website review,105,0.78,89,2024-01-31 00:17:49,134,29,223
870,1aft2j8,Cyberpunk 2077 Luke Ross VR,2,0.75,6,2024-01-31 21:21:03,2,0,8
871,1afnou3,Hellsplit Arena campaign mod?,3,1.0,2,2024-01-31 17:44:47,3,0,5
872,1afwhpg,Reccomendations for a new headset (on a budget),0,0.5,5,2024-01-31 23:42:35,0,0,5
873,1afw7w9,any new innovations in vr locomotion?,1,1.0,7,2024-01-31 23:30:51,1,0,8
874,1afpvkp,How expensive is full body tracking?,0,0.5,15,2024-01-31 19:12:07,0,0,15
875,1agb482,Vision Pro will constitute only 2.5% of Apple's total revenue,0,0.2,9,2024-02-01 13:34:34,0,0,9
876,1afjqmx,"Does anyone else think the original YAW motion seat was a much better, much more mass consumer friendly design?",5,0.65,10,2024-01-31 14:58:53,7,2,17
877,1afzkdk,Metro VR + vertigo Games,0,0.44,3,2024-02-01 02:05:05,0,0,3
878,1afnuir,Is it actually possible to use the pico4 with the quest 2 controllers? For PCVR,3,0.64,8,2024-01-31 17:51:03,4,1,12
879,1afsxom,HaritoraX Configurator loading wrong version,0,0.5,0,2024-01-31 21:15:41,0,0,0
880,1aepayx,"Apple Vision Pro review: magic, until it’s not",296,0.89,461,2024-01-30 14:10:56,332,36,793
881,1afsnph,Quest 3 vs AR Xreal Air 2 Pro for productivity,0,0.5,6,2024-01-31 21:04:35,0,0,6
882,1afj7y5,D-Day Enhanced Patch Notes 1.07 | PSVR2 Exclusive,4,0.83,0,2024-01-31 14:34:52,4,0,4
883,1af11c4,So what does the Vision Pro do worse than other headsets?,59,0.73,207,2024-01-30 22:13:44,80,21,287
884,1aflbnk,VR Health and Wellness Proposal for a Work Environment?,2,1.0,3,2024-01-31 16:07:55,2,0,5
885,1afqgho,"UEVR with knuckles controller, how to setup?",0,0.5,0,2024-01-31 19:35:50,0,0,0
886,1afpd5i,"Unsure as to why, but I'm starting to get motion sick.",1,0.66,6,2024-01-31 18:52:04,1,0,7
887,1afei81,"Fast Travel Games delivers record holiday sales, but studio CEO says VR market must ""define itself""",5,0.86,1,2024-01-31 10:03:45,5,0,6
888,1afoj20,What gunstock cups will fit my pimax crystal controller ?,0,0.5,0,2024-01-31 18:18:24,0,0,0
889,1aepiq2,Apple Vision Pro Review Roundup,163,0.93,261,2024-01-30 14:21:04,175,12,436
890,1afmvve,Cable extension capability (rift S),0,0.4,0,2024-01-31 17:12:19,0,0,0
891,1afmnws,Red Dead Redemption 2 in 3D - Unexpected Childcare - High Settings,2,0.6,3,2024-01-31 17:03:33,3,1,6
892,1afmiuh,4060 or 3060,1,1.0,3,2024-01-31 16:58:06,1,0,4
893,1af2kq3,Galaxy Kart is now Available on Meta Quest via App Lab! 🏁,24,0.89,0,2024-01-30 23:16:55,26,2,26
894,1afd6yo,VR headsets with variable focus distance,3,0.72,15,2024-01-31 08:28:40,4,1,19
895,1aer0db,A couple of very confusing paragraphs from the CNBC AVP review:,76,0.76,115,2024-01-30 15:28:13,100,24,215
896,1afj54y,There is only 2 days left and we’re almost there,0,0.5,5,2024-01-31 14:31:13,0,0,5
897,1af36c3,Why do you like VR?,13,0.73,62,2024-01-30 23:43:03,17,4,79
898,1aeuvfg,This 1986 VR NASA headset had 120° FOV,39,0.85,32,2024-01-30 18:05:39,45,6,77
899,1aegch8,"Apple Has Sold Approximately 200,000 Vision Pro Headsets",334,0.89,239,2024-01-30 04:55:57,375,41,614
900,1af2iou,"The Infinadeck is a real thing that works with VR, and sounds like they’re might be working on a consumer version",12,0.83,12,2024-01-30 23:14:30,14,2,26
901,1aeiq3p,Vision Pro review from someone who experienced it all,189,0.81,142,2024-01-30 07:22:47,233,44,375
902,1aeof02,Grandfather of the VR,59,0.95,4,2024-01-30 13:28:42,62,3,66
903,1aeteax,Vision Pro Review | WSJ,26,0.72,11,2024-01-30 17:06:11,36,10,47
904,1afeniv,Can Driver4VR translate Xbox controller inputs into VR controller inputs?,0,0.5,2,2024-01-31 10:14:28,0,0,2
905,1af0ufh,We NEED a quest emulator!!,9,0.64,24,2024-01-30 22:05:54,14,5,38
906,1afeedw,Need a validated video source for research,1,1.0,2,2024-01-31 09:56:05,1,0,3
907,1aet9ar,"Legendary designers Roberta and Dave Williams have returned, with a VR version of the seminal adventure game Colossal Cave -- and it's awesome",20,0.85,6,2024-01-30 17:00:54,23,3,29
908,1afduq1,Offroad MotorBike on App Lab (Meta Store),0,0.38,2,2024-01-31 09:16:51,0,0,2
909,1afouxi,The BEST Quest 3 Halo Battery Strap! - KKCOBVR Q3 PRO - Only £50! 😃🔥,0,0.13,0,2024-01-31 18:31:42,0,0,0
910,1afbsjy,Upgrade from 1080,0,0.5,12,2024-01-31 06:55:58,0,0,12
911,1aet0iv,Best bang for buck? Meta Quest 3?,15,0.73,48,2024-01-30 16:51:05,20,5,68
912,1aevzk9,Zoom launches new app for Apple Vision Pro to make hybrid collaboration more immersive,9,0.7,10,2024-01-30 18:49:45,12,3,22
913,1aez9ao,Roboquest | praydog UEVR |,4,0.63,0,2024-01-30 21:02:03,6,2,6
914,1afq58j,Am I the only one here who is 0 interested in the AVP???,0,0.38,45,2024-01-31 19:23:06,0,0,45
915,1ae3gev,Metro Awakening - new single-player VR Metro game to be announced at State of Play 2024,466,0.98,101,2024-01-29 19:13:23,475,9,576
916,1af8xzz,Looking to get a different head strap,1,0.67,7,2024-01-31 04:16:22,1,0,8
917,1af81rp,Remote computing with only an iPhone?,0,0.4,3,2024-01-31 03:31:19,0,0,3
918,1af7ba0,Put on tv,1,0.67,5,2024-01-31 02:54:48,1,0,6
919,1af6vi6,Replacement Pancake Lenses,1,0.67,7,2024-01-31 02:33:20,1,0,8
920,1afegav,Quest 3 VS Vive pro 2 or Vive pro if Wireless?,0,0.25,41,2024-01-31 10:00:14,0,0,41
921,1aexfim,Is it possible to feel motion sickness AFTER playing VR?,4,0.67,6,2024-01-30 19:47:30,5,1,11
922,1aenyka,what game is this?,8,0.75,9,2024-01-30 13:05:31,10,2,19
923,1aetds9,"Apple Vision Pro review: magic, until it’s not",3,0.55,5,2024-01-30 17:05:38,5,2,10
924,1af376c,Virtual Desktop vs Steamlink for pcvr,0,0.5,6,2024-01-30 23:44:05,0,0,6
925,1af2rsn,"After watching the Verge's review of the Apple Vision, I had a question about the technology involved",0,0.47,16,2024-01-30 23:25:26,0,0,16
926,1aeoeee,Mario 64 UEVR,6,0.75,6,2024-01-30 13:27:51,8,2,14
927,1aelz1o,Poker VR: New Features,9,1.0,2,2024-01-30 11:09:28,9,0,11
928,1aep9dm,Apple Vision Pro Unboxing!,5,0.56,3,2024-01-30 14:08:57,8,3,11
929,1af5vzb,First time buying. The easiest and best headset rn is the quest 3 correct? And do I understand correct I can use with or without pc? Some questions about it,0,0.33,2,2024-01-31 01:45:58,0,0,2
930,1afaa1i,"Will a Quest 2 continue to be relevant for 4+ years, or should I buy the Quest 3?",0,0.38,23,2024-01-31 05:27:55,0,0,23
931,1ae9mv8,"Huge VR arcade closing, tons of hardware for auction.",62,0.98,14,2024-01-29 23:29:39,63,1,77
932,1ae9wyo,Rogue Stargun - VR Starfighter game coming to the Quest Applab on February 1st,55,0.9,23,2024-01-29 23:41:51,61,6,84
933,1afdqxd,"Apple vision pro ain’t it after these reviews, what should I upgrade to",0,0.3,33,2024-01-31 09:09:18,0,0,33
934,1aej03h,Should apple have passed on the battery weight savings to its customer?,12,0.6,77,2024-01-30 07:41:16,20,8,97
935,1aexm45,"About to jump into VR for the first time, having a few questions..",0,0.5,11,2024-01-30 19:54:59,0,0,11
936,1aexk8u,autistic perspective,0,0.46,11,2024-01-30 19:52:48,0,0,11
937,1aemyoi,VR phobia,3,0.62,13,2024-01-30 12:10:22,4,1,17
938,1aex2vr,Nerf Ultimate Championship Custom Server Emulator,0,0.5,0,2024-01-30 19:33:01,0,0,0
939,1aewgfj,TOP 10 Must-Have Quest 3 VR Games Coming Out In 2024...,0,0.5,1,2024-01-30 19:08:11,0,0,1
940,1aecags,Is there a VR app where I can visit/walk around cities in other countries?,24,0.96,22,2024-01-30 01:31:50,25,1,47
941,1aeuzoq,"""BTW VR Videos on Youtube.com don't seem to work either"" AVP",0,0.48,15,2024-01-30 18:10:30,0,0,15
942,1af53w1,Vision Pro Battery is actually good long term,0,0.45,57,2024-01-31 01:09:39,0,0,57
943,1ae6gh5,Dissapointment in PCVR with Quest 3,39,0.71,122,2024-01-29 21:16:12,54,15,176
944,1ady4oc,Not my tempo VR simulator,94,0.93,11,2024-01-29 15:36:47,101,7,112
945,1af04fu,hello guys yt help fast pls,0,0.17,3,2024-01-30 21:37:02,0,0,3
946,1aeky30,Help me with some ideas for my vr game idea.,2,1.0,7,2024-01-30 10:00:18,2,0,9
947,1adq9pr,"I love VR, but I rarely play because of the hassle setting it up",210,0.87,208,2024-01-29 08:11:22,241,31,449
948,1aenzuy,Need some advice,1,0.67,1,2024-01-30 13:07:23,1,0,2
949,1af8vdy,I’ve been clowning on the Vision Pro a lot recently but this alone makes me wanna buy one and ditch my quest,0,0.31,78,2024-01-31 04:13:01,0,0,78
