Number,Id,Title,Upvotes,Upvote Ratio,Comments,Timestamp,Total Votes,Downvotes,Engagement
476,1akkfew,Main reason why i will never choose an Apple Headset over any other standalone vr device: Sideloading,0,0.5,46,2024-02-06 20:58:02,0,0,46
477,1ajf4gl,Simpsons predicted it once again! 💯,407,0.87,36,2024-02-05 12:16:23,467,60,503
478,1akv0fi,"Who else is still rocking the Index, waiting for the Deckard and loving the AVP content?",0,0.31,12,2024-02-07 04:58:02,0,0,12
479,1akrjz9,Biond City will be a dev Market place but is attached to a first of its kind no code builder that will democratize Metaverse - Gaming and Virtual Reality development in Unreal Engine.,0,0.17,0,2024-02-07 02:02:52,0,0,0
480,1akseo6,Spatial Computing on the Quest 3: Do You Really Need the Apple Vision Pro?,0,0.38,18,2024-02-07 02:44:21,0,0,18
481,1aknf1y,The quest 2 native head strap is just that bad,0,0.44,4,2024-02-06 22:57:25,0,0,4
482,1ajxzsd,How VR games helped me soldier thru my depressive episodes,21,0.88,3,2024-02-06 01:41:36,23,2,26
483,1akgz97,Ryzen 5 vs Ryzen 7 MSFS2020,0,0.33,2,2024-02-06 18:39:30,0,0,2
484,1akgi7c,Why can I not continue even after allowing all permissions?,0,0.4,0,2024-02-06 18:20:19,0,0,0
485,1akd8rs,Looking for new headset to replace CV1 - Advice please.,1,0.67,1,2024-02-06 16:05:09,1,0,2
486,1akcszi,Meta quest 3 or PSVR2,0,0.43,16,2024-02-06 15:45:56,0,0,16
487,1ak82hm,"You can change the size of your character any time you like! With it, your friends can lift you up and down!",2,0.75,0,2024-02-06 11:56:51,2,0,2
488,1ajx4uz,Philadelphia 76er Danuel House rockin a Vision Pro,14,0.61,11,2024-02-06 01:01:14,22,8,33
489,1akbxat,What VR Headset to treat anxiety disorder?,0,0.43,7,2024-02-06 15:08:20,0,0,7
490,1aj7b9y,Only for Apple Vision Pro,647,0.91,103,2024-02-05 03:55:39,710,63,813
491,1akazj2,Shooting 3D videos for the Quest,0,0.33,5,2024-02-06 14:27:07,0,0,5
492,1ajndv0,Our boxing meets rhythm VR game has a demo!,40,0.85,18,2024-02-05 18:18:08,47,7,65
493,1akj2kp,deku is wild! 😅🤣,0,0.2,0,2024-02-06 20:03:44,0,0,0
494,1ak9lzh,G2 vs q3 for pcvr,0,0.5,6,2024-02-06 13:21:38,0,0,6
495,1ak0b5n,Are Haptic Feedback VR Vests Worth It?,6,1.0,22,2024-02-06 03:35:31,6,0,28
496,1ajws36,Persona 3 Reload | praydog UEVR | AHUD UI Fix |,10,0.92,1,2024-02-06 00:45:04,10,0,11
497,1ak92dm,HITMAN World of Assassination Part One on 60% discount (HITMAN 3 support PCVR),1,0.67,3,2024-02-06 12:53:32,1,0,4
498,1aiwha2,How I see people now,1975,0.85,490,2024-02-04 19:42:26,2323,348,2813
499,1ak8s72,AR Office - Spatial Computing on the open Web ARO.Work,3,0.6,1,2024-02-06 12:37:54,5,2,6
500,1ajzht0,"""Dual Solo"" Band adapter clip",6,0.8,1,2024-02-06 02:54:14,7,1,8
501,1ak8p3q,PSA: Don't forget your passcode to your Apple Vision Pro or you will need to go to an Apple store to reset.,0,0.5,4,2024-02-06 12:33:06,0,0,4
502,1ajxsdg,Would y’all play this if devs made it easy to integrate UEVR?,8,0.72,11,2024-02-06 01:32:01,11,3,22
503,1ak82iu,"Best standalone (ish) for high quality video playback? No games, just VR videos.",0,0.5,16,2024-02-06 11:56:54,0,0,16
504,1ajw9xi,Best way to do cardio,9,1.0,23,2024-02-06 00:21:48,9,0,32
505,1ak7nfo,Overlaying video on another app in pico 4?,1,1.0,1,2024-02-06 11:30:47,1,0,2
506,1ak7l8k,How has the valve index held up?,1,0.54,38,2024-02-06 11:27:00,1,0,39
507,1akhenv,Best vr headset currently out or expected to be released that 3.5k can buy?,0,0.4,20,2024-02-06 18:56:33,0,0,20
508,1ajpeiq,Whitewater VR Steam Next Fest DEMO is out! https://store.steampowered.com/app/2360340/Whitewater_VR_Extreme_Kayaking_Adventure/,18,0.95,4,2024-02-05 19:38:56,18,0,22
509,1ak6zjs,HP Reverb G2 Vs Meta Quest 3 - side grade or upgrade?,1,0.6,31,2024-02-06 10:47:18,1,0,32
510,1ak3hgz,Varjo XR4 Comfort Mods?,2,1.0,1,2024-02-06 06:37:25,2,0,3
511,1ak5kno,Ar glasses without cable,0,0.4,9,2024-02-06 09:04:33,0,0,9
512,1ajr11w,Is there a good vr wild west game like rdr2?,10,0.92,17,2024-02-05 20:43:58,10,0,27
513,1ajsomv,Pacific Drive (DEMO) in UEVR,7,0.82,5,2024-02-05 21:50:44,8,1,13
514,1ak13cp,Konami finally unveiled a Yugioh VR experience,2,0.75,1,2024-02-06 04:17:32,2,0,3
515,1ak4iq2,Tablet capable of outputting 4K for AR/VR purposes,1,0.67,2,2024-02-06 07:46:44,1,0,3
516,1ajw0cj,Stumbled upon this on Twitter. Anyone heard about(or checked out) this project?,4,0.84,2,2024-02-06 00:09:44,4,0,6
517,1akeyzh,"VR in a high period, but I’m in a low",0,0.29,19,2024-02-06 17:17:43,0,0,19
518,1ak4404,What Reality Headset is best for 3rd party gaming on a gaming PC?,0,0.43,20,2024-02-06 07:17:37,0,0,20
519,1ajzuk8,It would be nice to have an open motion controller standard for hand tracked headsets,2,0.75,0,2024-02-06 03:11:37,2,0,2
520,1aj4mr7,Apple Vision Pro head strap actually works quite well on the Bigscreen Beyond!,224,0.92,39,2024-02-05 01:36:07,243,19,282
521,1ajap7j,Someone already got the ALVR client running on Apple Vision Pro,61,0.86,36,2024-02-05 07:13:51,70,9,106
522,1ak2f7d,Where can I demo vr?,0,0.33,13,2024-02-06 05:32:41,0,0,13
523,1ajjt1h,Genotype - HUGE combat overhaul will be released on February 8th! 🐧💥,12,0.8,8,2024-02-05 15:56:32,15,3,23
524,1ak9zxe,Swandive on Apple Vision Pro,0,0.22,0,2024-02-06 13:40:56,0,0,0
525,1ajolza,Building a VR friendly vehicle navigation system for my procedural city,6,0.88,1,2024-02-05 19:07:06,6,0,7
526,1akmpcy,Are there any VR headsets that aren't made by some awful megacorp?,0,0.24,43,2024-02-06 22:28:21,0,0,43
527,1ajqsn5,Best current PCVR headset under 500$?,4,0.83,29,2024-02-05 20:34:24,4,0,33
528,1aiuh5a,Spacially Distracted Boyfriend,464,0.96,15,2024-02-04 18:20:15,483,19,498
529,1ajhxww,"Fast Travel Games is publishing 'Black Forge VR', a VR weapon crafting game for Quest/PCVR in 2024",11,0.87,2,2024-02-05 14:35:11,12,1,14
530,1ajsd8b,Can someone share their experience with a 4090m (laptop)?,3,1.0,11,2024-02-05 21:37:39,3,0,14
531,1ak09lx,VR headset concept (I have more if you want),0,0.4,2,2024-02-06 03:33:18,0,0,2
532,1ajve63,Battle glide Vs Resist,2,1.0,1,2024-02-05 23:43:01,2,0,3
533,1aj7r7a,Me in my Vision Pro headset at work when my coworker is trying to tell me about their weekend,68,0.82,4,2024-02-05 04:19:13,82,14,86
534,1ajy1zu,Make your own 3D VR 180 (spacial) videos with 2 cameras?,1,0.67,2,2024-02-06 01:44:27,1,0,3
535,1ajgjxa,Which VR is best for having two headsets in the same room?,9,0.91,14,2024-02-05 13:30:58,9,0,23
536,1ajx9rf,Should I buy the Pico 4 or the Quest 2?,0,0.5,15,2024-02-06 01:07:26,0,0,15
537,1ajo23r,VR Design Research Survey,3,1.0,1,2024-02-05 18:45:20,3,0,4
538,1aiy5mn,I don’t understand the hate for the Apple Vision Pro.,160,0.65,472,2024-02-04 20:49:55,246,86,718
539,1ajvykh,"The concept around the metaverse and virtual reality kickstarted my passion project. I just posted my first video which explores how disruptive technologies like VR become mainstream, the biggest barriers to adoption, and some of its ethics + privacy concerns.",0,0.5,0,2024-02-06 00:07:32,0,0,0
540,1aikgkz,"All it took was one company with a cool brand and great marketing to normalize wearing a VR headset erm spatial computer on your face in public. Bravo Apple, not even mad",1117,0.78,754,2024-02-04 09:53:24,1432,315,2186
541,1ak40qg,PSA - don’t use a AR/XR or “spatial computer” while driving,0,0.14,1,2024-02-06 07:11:37,0,0,1
542,1ak5eqq,"Midjourney hires veteran Apple Vision Pro engineer as head of hardware to build its ""Orb""",0,0.2,6,2024-02-06 08:52:33,0,0,6
543,1ajtnhd,Headset recs,1,0.67,8,2024-02-05 22:30:25,1,0,9
544,1ajsf2s,VR for Business,0,0.5,6,2024-02-05 21:39:42,0,0,6
545,1ajscse,Anyone using MPC-BE via Virtual Desktop for 3D movies?,1,1.0,7,2024-02-05 21:37:08,1,0,8
546,1ajxblb,Inquiring About Apple Vision Pro's Physical Dimensions,0,0.33,2,2024-02-06 01:09:56,0,0,2
547,1ajla8j,Upgrading PCVR in 2024,4,0.75,4,2024-02-05 16:56:59,5,1,9
548,1ajq962,rift s vs quest 2,0,0.5,14,2024-02-05 20:12:47,0,0,14
549,1ajq4gk,meta quest app sharing,0,0.5,3,2024-02-05 20:07:34,0,0,3
550,1ajq041,What is the best cpu for Vr,1,0.6,8,2024-02-05 20:02:44,1,0,9
551,1ajei7m,"Early Reporting on Binaural Recording (1975, German)",5,0.86,0,2024-02-05 11:38:49,5,0,5
552,1ajfsyk,Second VR experience after gear vr with controller what to expect?,3,1.0,4,2024-02-05 12:53:33,3,0,7
553,1ajtncu,typing on quest is faster than on apple vision pro,0,0.47,19,2024-02-05 22:30:18,0,0,19
554,1ajy450,Quest 3 or HTC Vive Cosmos Elite,0,0.17,14,2024-02-06 01:47:15,0,0,14
555,1ajxhcz,My vision of standalone headsets in 10-15 years,0,0.25,5,2024-02-06 01:17:27,0,0,5
556,1ajh34q,Are there any good VR data visualization apps?,2,1.0,6,2024-02-05 13:56:15,2,0,8
557,1aj62bm,VR headsets being non-modular is understandable but sad,14,0.82,6,2024-02-05 02:49:08,17,3,23
558,1ajlqc6,Quest 3 PCVR flat games in 1 fps?,0,0.33,2,2024-02-05 17:14:20,0,0,2
559,1ajr2ih,VR/AR Headset for Programming,0,0.25,19,2024-02-05 20:45:40,0,0,19
560,1ai5chh,Google glass was ahead of its time..,3783,0.92,401,2024-02-03 20:28:08,4111,328,4512
561,1ajkutd,possible to reactivate motion controls in Luke Ross REAL mod?,1,1.0,0,2024-02-05 16:40:04,1,0,1
562,1aiqm67,"Valve updated the Steam Hardware Survey data after publication, creating a new entry for Bigscreen Beyond",101,0.98,62,2024-02-04 15:38:37,103,2,165
563,1ajvpiq,Why doesn't anyone create a VR/AR set with a separate computing device?,0,0.36,9,2024-02-05 23:56:57,0,0,9
564,1aj8fly,Drawing Desk is now available on Vision Pro (FREE),6,0.65,1,2024-02-05 04:56:31,9,3,10
565,1aiwk41,Games you genuinely enjoy playing on UEVR???,42,0.92,52,2024-02-04 19:45:37,45,3,97
566,1ajjto0,"Just released: Doodle Board 3-player (Tri-Op, as opposed to Co-Op?)",1,1.0,1,2024-02-05 15:57:19,1,0,2
567,1ajjsam,"Just released: Doodle Board 3-player (Tri-Op, as opposed to Co-Op?)",1,1.0,1,2024-02-05 15:55:40,1,0,2
568,1ajexu9,Good games to play one handed?,2,1.0,26,2024-02-05 12:05:31,2,0,28
569,1ajje5c,Master the Matrix: Unleash Your Inner Hero in #HardBullet #VR,0,0.4,0,2024-02-05 15:39:12,0,0,0
570,1aiyyjq,"You can vote for a VR mode in Payday 3! (one click, no registration or anything else needed)",29,0.94,1,2024-02-04 21:22:27,30,1,31
571,1aitzw0,Bringing JetSetRadio to VR!,55,0.93,10,2024-02-04 18:00:33,59,4,69
572,1ajit36,Does wearing the headset closer or further away cause VR proportions to be wrong?,0,0.5,7,2024-02-05 15:13:24,0,0,7
573,1ait7hs,Introducing: Metro Awakening – A new VR Metro game by Vertigo Games,47,0.9,9,2024-02-04 17:27:39,52,5,61
574,1ajhln0,How to convert 360 ° mono video to 180° ?,1,1.0,4,2024-02-05 14:19:48,1,0,5
575,1ajbjic,UEVR trojan message Trojan:Win32/Malagent!MSR ?,2,0.67,3,2024-02-05 08:11:31,2,0,5
576,1ajh9r9,Pico 4 vs Quest 3 for PCVR?,2,0.62,17,2024-02-05 14:04:13,3,1,20
577,1ajh5j4,"Weird question I know but, Blade and Sorcery Nomad VS Resist. Like genuinely. Which ones more fun.",1,0.67,3,2024-02-05 13:59:24,1,0,4
578,1ak35pm,Kai Cenat Facetimes Celebrities With Apple Vision Pro,0,0.11,3,2024-02-06 06:17:18,0,0,3
579,1ajfxs5,Best VR headset for beginner?,1,0.67,5,2024-02-05 13:00:41,1,0,6
580,1ajf8l3,Quest 3 body tracking vr chat,0,0.5,2,2024-02-05 12:22:46,0,0,2
581,1airp82,Working in the Vision Pro,40,0.73,41,2024-02-04 16:24:50,54,14,95
582,1aj9d3x,Can you use the quest 3 like a phone?,2,0.63,6,2024-02-05 05:50:11,3,1,9
583,1aij99n,The original augumented reality.,128,0.89,9,2024-02-04 08:31:55,143,15,152
584,1ajqqcr,The AVP FOV is much wider without the facial interface.,0,0.28,11,2024-02-05 20:31:45,0,0,11
585,1ajdgfh,Did I get a bad unit?,0,0.4,22,2024-02-05 10:30:49,0,0,22
586,1aj6549,Interactivity is not essential for a top tier VR experience,4,0.63,22,2024-02-05 02:53:13,6,2,28
587,1ajd39d,Quest 3 vs PCVR game recommendations,0,0.43,6,2024-02-05 10:04:51,0,0,6
588,1aj4yg4,"NGL, I'm kinda worried about so many people using the Vision Pro outside during the day.",3,0.54,43,2024-02-05 01:52:24,5,2,48
589,1ai7vll,green bubbles smh,632,0.98,21,2024-02-03 22:19:33,644,12,665
590,1ajccru,"Yu-Gi-Oh! Duel Links ""gameplay"" video looks fake AF for me, but it still looks awesome!",0,0.5,2,2024-02-05 09:11:08,0,0,2
591,1ajc9mu,"The Quest for a True VR GPS Map: Why Isn't There a More Immersive VR GPS System Yet?""",0,0.47,15,2024-02-05 09:04:45,0,0,15
592,1aj5ym6,What new VR cameras are coming out soon? 180 and 360,3,1.0,6,2024-02-05 02:43:49,3,0,9
593,1ajbtxy,"If i just put the same video side by side, can i view it in vr?",1,0.67,2,2024-02-05 08:32:52,1,0,3
594,1aix0tn,Are we the weird friend?,9,0.8,24,2024-02-04 20:03:52,11,2,35
595,1ajnf9t,Working in the Vision Pro,0,0.23,4,2024-02-05 18:19:42,0,0,4
596,1ail1u2,"The AVP drive mode in practice, featuring the cybertruck.",46,0.66,49,2024-02-04 10:33:15,69,23,118
597,1ajmx3z,"The Apple TrueVision™, coming to your head.. in a decade probably",0,0.3,3,2024-02-05 18:00:11,0,0,3
598,1aj9wzx,After some time my full body tracking goes sideways?,1,0.66,4,2024-02-05 06:23:27,1,0,5
599,1ajeyrr,What can the Vision Pro do that the Quest 3 can not?,0,0.45,47,2024-02-05 12:07:02,0,0,47
600,1aiqt7u,What can I actually do with the AVP that I can't with the Quest 3?,9,0.57,138,2024-02-04 15:47:24,15,6,153
601,1ait1oy,Virtual Desktop Now Supports Quest Pro Tongue Tracking & OpenXR Tracking Forwarding,8,0.84,1,2024-02-04 17:20:47,9,1,10
602,1aitxk5,"Mods, Apple Vision Pro flair when?",9,0.61,16,2024-02-04 17:57:56,14,5,30
603,1aj8d0c,Fun VR Games?,1,0.67,9,2024-02-05 04:52:24,1,0,10
604,1aillo6,"Me and a ChatGPT NPC in VR / MR (Mixed Reality) on Quest 3, showing AI n...",24,0.84,40,2024-02-04 11:09:32,28,4,68
605,1aiuh53,Offroad Motorbike On AppLab (Meta Store) Gameplay,6,0.71,1,2024-02-04 18:20:15,8,2,9
606,1aiup6x,People are having sex in VR using Bluetooth sex toys,6,0.56,44,2024-02-04 18:29:40,10,4,54
607,1aisdk7,What are some good earbuds for VR?,6,0.88,10,2024-02-04 16:52:52,6,0,16
608,1aj5pen,AVP with bluetooth & accelerometer nunchucks?,0,0.5,5,2024-02-05 02:30:34,0,0,5
609,1ait5aj,Oceanhorn 2 | praydog UEVR | AHUD UI Fix |,5,0.73,1,2024-02-04 17:25:04,6,1,7
610,1aid7cf,Apple Vision Pro Review: Tomorrow's Ideas... Today's Tech!,63,0.76,42,2024-02-04 02:32:21,82,19,124
611,1aj3lvo,VR 360° 4K Flight Over Skyscraper_06,0,0.5,0,2024-02-05 00:46:44,0,0,0
612,1aj3jaz,Due to the hype of Quest 3 I'm considering finally getting VR - have a few questions.,1,0.6,10,2024-02-05 00:43:20,1,0,11
613,1ajc43f,"Okay, it's been ~a week. Where's the third-party knock-off AppleVP strap for Quest?",0,0.2,5,2024-02-05 08:53:37,0,0,5
614,1aix1dl,"How Good is the HTRF ""Spatial Audio"" on the Apple Vision Pro?",0,0.5,10,2024-02-04 20:04:31,0,0,10
615,1aj18wp,Apple Vision Pro First Impressions From A VR Enthusiasts Perspective! - VROasis,2,0.53,38,2024-02-04 22:59:47,3,1,41
616,1ai952t,Bruh... I hope they'll make this available for the Quest,64,0.69,61,2024-02-03 23:16:01,92,28,153
617,1aio1xx,Does anyone know of a photo/video of the Apple Vision Pro Through the lenses?,6,0.74,8,2024-02-04 13:36:54,8,2,16
618,1aiybvz,Talos 2 crashes with UEVR injector,1,0.67,4,2024-02-04 20:56:47,1,0,5
619,1ai40st,Got my hands on some Apple Vision Software,106,0.96,2,2024-02-03 19:29:19,110,4,112
620,1aixs4j,Ben 10 game/mods?,0,0.5,3,2024-02-04 20:34:47,0,0,3
621,1aix44a,Is the Pico 4 still a good headset?,1,0.67,12,2024-02-04 20:07:29,1,0,13
622,1ai8wol,"Using the Meta Quest 3 as a monitor for my steam deck with Immersed is super awesome, i don’t even need Xreal Glasses now",48,0.89,18,2024-02-03 23:05:41,53,5,71
623,1ai1hk6,First impression of Vision Pro from a VR user with highest PPD& biggest FOV PCVR hmds,125,0.86,70,2024-02-03 17:36:50,145,20,215
624,1ainejg,Any liminal spaces VR games?,3,0.8,7,2024-02-04 13:02:08,3,0,10
625,1aj6zq2,Why recent vr headsets don't have AI 2D ti 3D conversion like lume pad 2?,0,0.27,7,2024-02-05 03:38:25,0,0,7
626,1aip728,Can you play Xbox or playstation With apple vision pro ?,3,0.63,15,2024-02-04 14:34:07,4,1,19
627,1aip5dw,Watch Disney+ 3d movies without a Vision Pro ?,1,0.57,9,2024-02-04 14:31:50,1,0,10
628,1aikx16,Which Headsets have no longer visible pixel grid?,5,0.78,16,2024-02-04 10:24:20,6,1,22
629,1aitp1o,Are there any good VR battle Royales with realistic guns?,1,1.0,15,2024-02-04 17:48:02,1,0,16
630,1ai0ed3,Quest user just came out of Vision Pro Demo. Speechless. Emotional experience.,94,0.59,286,2024-02-03 16:49:17,159,65,445
631,1aikfn3,Feedback wanted!,5,1.0,0,2024-02-04 09:51:35,5,0,5
632,1ahwoyo,Why is everyone comparing the Quest 3 to Alien Vs Predator?,150,0.82,28,2024-02-03 13:58:44,182,32,210
633,1ahmnaa,Apple Vision Pro Spatial awareness is incredible,794,0.91,243,2024-02-03 03:37:28,872,78,1115
634,1aim98j,Injector for Quake II (idtech 2)?,2,0.75,14,2024-02-04 11:53:22,2,0,16
635,1ahz9v9,Multiplayer Co-Location in VR is awesome,66,0.9,9,2024-02-03 15:59:58,73,7,82
636,1aiohww,Is VR feeling less immersive to anyone else?,0,0.4,8,2024-02-04 13:59:53,0,0,8
637,1ahwmbg,Apple Vision Pro Initial Thoughts - From a Quest 3 User,85,0.69,90,2024-02-03 13:55:05,123,38,213
638,1ai6e8q,Apple Vision Pro 30 Minute Demo Review (Non-Weak Neck User),21,0.63,75,2024-02-03 21:14:08,33,12,108
639,1aint0r,Is it possible to connect Windows Mixed Reality controllers to Oculus Rift S using Driver4vr?,0,0.5,8,2024-02-04 13:23:55,0,0,8
640,1aik3ci,PC VR headset with pancake lenses,2,0.63,9,2024-02-04 09:28:55,3,1,12
641,1aihk9t,Apple got some of y'all like this RN and I'm dying laughing.,2,0.58,0,2024-02-04 06:39:00,3,1,3
642,1ai96vw,iFixit: Vision Pro Teardown,12,0.83,1,2024-02-03 23:18:25,14,2,15
643,1ai4pz6,"This ""Body simulating engine"" is revolutionary for vr and deserves more attention. Once its finished it should become a standard!",15,0.94,3,2024-02-03 20:00:27,15,0,18
644,1aikp90,Buying the AVP without knowing FOV is like buying a phone without knowing the screen size,2,0.54,15,2024-02-04 10:09:23,3,1,18
645,1aika2c,How can I play flat screen games on VR?,0,0.5,6,2024-02-04 09:41:30,0,0,6
646,1aik4yz,Looking for suggestions :3,0,0.33,2,2024-02-04 09:31:51,0,0,2
647,1aiyt78,"Fellas, do the PSVR2’s issues actually not matter?",0,0.28,29,2024-02-04 21:16:25,0,0,29
648,1aiebmv,the thing no one will say about Apple Vision Pro,1,0.52,4,2024-02-04 03:31:15,1,0,5
649,1ahelwn,Vision pro size comparison to the quest 3,474,0.92,186,2024-02-02 21:20:43,515,41,701
650,1ai02q5,Are base stations still worth it in 2024 ?,14,0.75,29,2024-02-03 16:34:50,18,4,47
651,1ahvz8n,It never occurred to me to use UEVR on Unreal Engine tech demos...,22,0.82,5,2024-02-03 13:21:17,26,4,31
652,1ahns01,Just spent 3 hours in the AVP - first impressions.,110,0.76,137,2024-02-03 04:38:31,144,34,281
653,1ai7kzr,Final thesis survey,4,1.0,3,2024-02-03 22:06:29,4,0,7
654,1ahtx03,This game was made for VR! // Hypercharge Unboxed,27,0.89,4,2024-02-03 11:16:16,30,3,34
655,1ai6ehe,Why does Arizona Sunshine 2 on PC require 42GB of storage while the PSVR2 version only requires 16GB of storage?,5,0.73,4,2024-02-03 21:14:26,6,1,10
656,1ahzov2,Anyone using VR to help with anxiety?,9,0.8,10,2024-02-03 16:17:53,11,2,21
657,1air5f2,Meta Quest 3 or Wait for Valve Deckard?,0,0.22,49,2024-02-04 16:01:49,0,0,49
658,1aijwtf,My concept for a vr alien apocalypse.,0,0.29,1,2024-02-04 09:16:18,0,0,1
659,1aidxwa,"I’ve seen some stuff online about computer monitors that are see through/transparent. Assuming it’s not legitimate, how come AR works through exterior cameras feeding you reality as opposed to just superimposing images through a transparent monitor onto actual reality?",2,0.58,19,2024-02-04 03:11:06,3,1,22
660,1aippht,"Is it difficult for a full vr world to be created for the apple vision pro in the next 5 years, with its own ecosystem and exploration, that includes motion tracking for travel?",0,0.15,9,2024-02-04 14:58:37,0,0,9
661,1aidhjq,How feasible is large fov with micro oled?,1,1.0,7,2024-02-04 02:47:25,1,0,8
662,1aini9y,Tips & Tricks on Travel with Vision Pro on a Plane (and others reaction),0,0.23,0,2024-02-04 13:07:58,0,0,0
663,1ahveyf,Week 2: Quest 3 coming from HP Reverb G2,13,0.88,6,2024-02-03 12:50:46,14,1,20
664,1aijqai,We are entering the normieverse,0,0.39,17,2024-02-04 09:04:11,0,0,17
665,1aibsam,Why is Blade & Sorcery in my Library on my Desktop but not inside VR?,0,0.5,0,2024-02-04 01:20:14,0,0,0
666,1ai6rws,I'm a programmer and i recently got Quest 3 and wanted to test if I can code in VR. The purpose of this test was to explore the future of software development. Here is my experience.,2,0.6,5,2024-02-03 21:30:50,3,1,8
667,1aibeug,Test Driving Cars | Spatial Entertainment Mixed Reality,2,0.62,0,2024-02-04 01:01:36,3,1,3
668,1ahetya,Can we have a little perspective please?,156,0.8,160,2024-02-02 21:30:29,195,39,355
669,1aib3wf,which headset should i buy?,1,0.67,6,2024-02-04 00:46:46,1,0,7
670,1aib3dm,Does Praydog's RE4 remake mod have motion controls yet?,1,0.6,8,2024-02-04 00:46:02,1,0,9
671,1ahv71v,"Question about 3D movies, particularly *Avatar*.",9,0.91,18,2024-02-03 12:37:23,9,0,27
672,1ai0l2t,Ruff Talk VR Gaming Showcase 2024,3,0.62,1,2024-02-03 16:57:38,4,1,5
673,1ai5gni,Any R6 style game in VR?,2,1.0,5,2024-02-03 20:33:22,2,0,7
674,1aiafv9,Why do headsets use small cameras for passthrough ?,0,0.43,11,2024-02-04 00:15:05,0,0,11
675,1aigr3p,What will an Apple Vision Air/SE look like and be priced at ?,0,0.33,7,2024-02-04 05:49:24,0,0,7
676,1aiqdbu,Apple Vision Pro is not a VR headset,0,0.31,16,2024-02-04 15:27:44,0,0,16
677,1ahggey,First Impression - Vision Pro,80,0.86,59,2024-02-02 22:39:50,93,13,152
678,1ah4av3,Vision Pro has a driving mode,380,0.84,95,2024-02-02 13:59:15,452,72,547
679,1ahzl7e,Good enough for work? (Coding),3,0.8,13,2024-02-03 16:13:33,3,0,16
680,1aieuh7,What the hell,0,0.47,9,2024-02-04 04:00:07,0,0,9
681,1aipg8n,The one thing that bothers me about the AVP release,0,0.13,25,2024-02-04 14:46:20,0,0,25
682,1ai6u3x,Review and ranking of only the form factor and weight of Vision Pro,2,0.62,1,2024-02-03 21:33:35,3,1,4
683,1ai6huv,Confusing the heck out of myself right now,1,0.6,1,2024-02-03 21:18:38,1,0,2
684,1ai61id,Casey Neistat’s absolute wild Vision Pro Video,0,0.48,27,2024-02-03 20:58:33,0,0,27
685,1ai5p6u,Quest 2 recommended for PC or no?,1,1.0,3,2024-02-03 20:43:50,1,0,4
686,1ai5ijg,Do you think we will start to see video recordings make use of depth sensors?,1,0.67,1,2024-02-03 20:35:37,1,0,2
687,1ai4vqx,Need Advice from VR artists: Octane render is a good shot?,1,1.0,1,2024-02-03 20:07:17,1,0,2
688,1ai4o9g,Quest 3 controller haptics don't always trigger,1,0.67,3,2024-02-03 19:58:21,1,0,4
689,1ai3x8h,PC hardware requirement for games released for Quest 2,0,0.5,1,2024-02-03 19:24:44,0,0,1
690,1ahrq31,Offroad MotorBike On App Lab (Meta Store) v1.0.2,8,0.83,6,2024-02-03 08:46:45,9,1,15
691,1ah41f9,"Quest 3 Is Now The 3rd Most Used Headset On Steam, Rapidly Approaching Valve Index",233,0.95,83,2024-02-02 13:46:41,245,12,328
692,1ahy5ym,Privacy minded headset,1,0.57,4,2024-02-03 15:08:47,1,0,5
693,1ai33nv,I'm looking to buy a vr headset however not sure which one to get and don't know too much about them,1,1.0,2,2024-02-03 18:47:50,1,0,3
694,1aig33o,Apple vs. Android: The VR Platform Wars Have Begun! ft. Ben Lang (Road to VR),0,0.18,1,2024-02-04 05:09:42,0,0,1
695,1ah17pd,"Quest 3 Launch Drove Highest Ever Meta Reality Labs Quarterly Revenue, Over $1 Billion",277,0.95,106,2024-02-02 11:06:17,291,14,397
696,1aicj72,Casey Neistats Vision Pro video can be recreated with a Quest3,0,0.31,2,2024-02-04 01:57:56,0,0,2
697,1ahvx9u,"Looking for a new VR set up, advice on content libraries comparison",2,0.75,7,2024-02-03 13:18:22,2,0,9
698,1ahnrkv,"Best PCVR headset, no base stations",7,0.69,36,2024-02-03 04:37:50,10,3,46
699,1ah7cut,Jesse what,70,0.9,3,2024-02-02 16:14:21,77,7,80
700,1ahts6h,Can Vision Pro play VR180 ? and can you stream videos from a PC to Vision Pro ?,2,0.6,9,2024-02-03 11:07:50,3,1,12
701,1ahn399,Vision Pro Tribute from a Quest User > Vision Pro Headband Adapters for Quest 3,9,0.62,14,2024-02-03 04:01:09,14,5,28
702,1ahdu2k,SadlyItsBradley - VisionPro Livestream,28,0.63,34,2024-02-02 20:48:35,44,16,78
703,1ah8ig6,We've been experimenting with our game on Vision Pro,44,0.82,5,2024-02-02 17:02:38,53,9,58
704,1ahnvpn,Meta Quest 3 or PSVR2?,5,0.69,43,2024-02-03 04:44:15,7,2,50
705,1ai906l,Anyone feel like apple vision is going to negatively effect vr in the long run,0,0.42,31,2024-02-03 23:10:05,0,0,31
706,1ai0x3f,Is there a Meta quest 3.4 or pro on the horizon?,0,0.25,7,2024-02-03 17:11:55,0,0,7
707,1ahvjp2,"My Oculus Rift CV1 is giving me issues, thinking of getting a new VR device",0,0.4,7,2024-02-03 12:58:38,0,0,7
708,1ahv0p8,OSU on Vision Pro,1,0.6,3,2024-02-03 12:26:56,1,0,4
709,1ahuv49,Is the Quest 3 capable of making the realistic avatars that the AVP is?,0,0.5,6,2024-02-03 12:17:29,0,0,6
710,1ah5pv8,Vision Pro Preview: Early Thoughts on My Time Inside Apple’s First Headset,52,0.79,25,2024-02-02 15:01:52,65,13,90
711,1aie8fs,"Now that the Vision Pro is out, how long do you think we have until physical monitors are mostly or completely phased out?",0,0.2,33,2024-02-04 03:26:36,0,0,33
712,1ahuivc,"What options do we have for natural motion in VR at the moment, in terms of treadmills?",0,0.5,1,2024-02-03 11:56:46,0,0,1
713,1ahp3ti,Meta Quest 2 - Thumbstick Drift,3,0.8,4,2024-02-03 05:54:32,3,0,7
714,1ah31qe,Meta Quest receives spatial video and gesture support as company hopes the Apple Vision Pro can save mixed reality,65,0.71,50,2024-02-02 12:57:03,91,26,141
715,1ai9xe3,Apple Vision Pro vs Oculus shift CV1 side by side size comparison,0,0.14,5,2024-02-03 23:51:34,0,0,5
716,1ah2qkq,Zenith is Going Free To Play With a Separate Mode,67,0.89,29,2024-02-02 12:40:16,75,8,104
717,1ahslhm,Is it possible to use a Quest 2 with only hand tracking?,1,0.67,1,2024-02-03 09:46:39,1,0,2
718,1ah9412,Puzzling places launches today on Vision Pro,21,0.77,12,2024-02-02 17:28:13,27,6,39
