Number,Id,Title,Upvotes,Upvote Ratio,Comments,Timestamp,Total Votes,Downvotes,Engagement
245,1amrf73,Down river kayaking,15,0.83,7,2024-02-09 16:00:49,18,3,25
246,1an665s,"Is the new quest 3 worth buying, or should i just get a new quest 2",2,0.75,4,2024-02-10 02:54:00,2,0,6
247,1amxt3v,What Pc and VR headset should I get for civilian style driving simulator?,6,0.87,10,2024-02-09 20:29:53,6,0,16
248,1am4f5r,"Assassin's Creed VR had poor sales, Ubisoft CEO says they won't be heavily investing in VR going forward.",556,0.97,536,2024-02-08 19:49:02,573,17,1109
249,1anhc11,How to study spatial computing?,0,0.31,7,2024-02-10 14:18:54,0,0,7
250,1an4lrd,PCVR: Getting super poor performance suddenly,2,1.0,11,2024-02-10 01:34:59,2,0,13
251,1an4j31,Looking for build advice/suggestions - VRPC For Index,2,1.0,0,2024-02-10 01:31:19,2,0,2
252,1amlx7b,"Would you like to learn new language in VR? Check out Mondly: Practice Languages in VR! Also, Discord server launch!",27,0.97,3,2024-02-09 11:19:43,27,0,30
253,1anevsi,Apple Vision Pro Hidden Feature ✈️ #protip - News,0,0.27,2,2024-02-10 12:05:47,0,0,2
254,1an6vtu,"Quest 2 Steam link, air link, connected with a ucb c, Bugging out and Skipping frames. This happens to me in every game while using a pc.",0,0.33,5,2024-02-10 03:32:47,0,0,5
255,1anjeog,"How is Apple Vision Pro outside of ""spacial computing""?",0,0.37,57,2024-02-10 15:56:41,0,0,57
256,1an62ky,"Newbie Need VR- My Head is spinning, which headset!",0,0.5,15,2024-02-10 02:48:42,0,0,15
257,1anpjai,I don’t think this is supposed to come off,0,0.14,17,2024-02-10 20:27:03,0,0,17
258,1am861y,Exclusives Are Bad for VR Overall,165,0.85,165,2024-02-08 22:26:50,194,29,359
259,1amx3ny,A good friend is one of the main creators of this game!!,3,0.72,0,2024-02-09 20:00:00,4,1,4
260,1amotd0,"ELI5 what's the difference between spatial video, sbs, volumetric, and all the other versions?",9,0.76,19,2024-02-09 14:02:06,11,2,30
261,1an971t,I want to learn some things about my career,0,0.25,0,2024-02-10 05:43:15,0,0,0
262,1amt6a0,"So now that Virtual Desktop supports upper body tracking data from the Quest 3, how do I use it in VRChat?",5,1.0,0,2024-02-09 17:13:13,5,0,5
263,1an4e8f,why does my q3 just refuse to work on pcvr,0,0.5,12,2024-02-10 01:24:43,0,0,12
264,1amwa0i,"NEW VR GAMES OUT THIS WEEK!! Quest 3, PSVR 2",3,1.0,0,2024-02-09 19:24:18,3,0,3
265,1amt19v,recommendations for a headset for somebody with prescription lenses,4,1.0,14,2024-02-09 17:07:42,4,0,18
266,1amf2na,I wish some of the VR games on 'dead' platforms would make their way to modern platforms,45,0.92,38,2024-02-09 03:55:18,48,3,86
267,1am28aa,"After 3 years, Dragon Fist: VR Kung Fu now has Multiplayer and is officially updated on the Meta Store & Steam!",266,0.98,3,2024-02-08 18:16:59,271,5,274
268,1anifis,"Can someone enlighten me what tech Tony Stark was using to achieve ""spatial computing"" without headsets?",0,0.2,31,2024-02-10 15:11:51,0,0,31
269,1amqpgm,Full dive Vr projects?,3,0.55,19,2024-02-09 15:29:25,5,2,24
270,1amvxur,MRTV teases PCVR headset with Apple Vision Pro quality displays and lenses!,2,0.53,35,2024-02-09 19:09:50,3,1,38
271,1am45jz,Ubisoft won’t increase VR investment after Assassin’s Creed disappointment.,140,0.94,76,2024-02-08 19:37:43,148,8,224
272,1anaaz7,Shark Encounter VR with girl scared of sharks and jump scares,0,0.2,0,2024-02-10 06:52:21,0,0,0
273,1amzzxo,Be gentle! Just got a rift S!,1,0.67,4,2024-02-09 22:04:14,1,0,5
274,1alsekw,"T-Pain on the Vision Pro: ""I’m not a part of this weak ass reality anymore. This how I’m showin up everywhere so just don’t even say anything about it when I come in the room. ITS OVER!!""
",727,0.86,269,2024-02-08 10:05:36,845,118,1114
275,1ambhvu,Is it worth it if I have a blind eye?,47,0.93,44,2024-02-09 00:57:49,50,3,94
276,1an8hlz,Almost half of the security vendors on Virustotal flag Unreal Engine VR injector as malware,0,0.27,6,2024-02-10 05:01:54,0,0,6
277,1amyu0y,How to Watch 8K VR180 and 3D 360 Video on Apple Vision Pro,2,0.56,2,2024-02-09 21:13:49,3,1,5
278,1amxemo,Do you think BigScreen Beyond is future proof?,0,0.48,55,2024-02-09 20:12:35,0,0,55
279,1ancit1,Apple doesn't want you to know you can make your own Apple Vision Pro (kinda),0,0.19,1,2024-02-10 09:24:47,0,0,1
280,1amjey4,Non-gaming uses of VR that have a positive impact?,7,0.82,32,2024-02-09 08:19:14,8,1,40
281,1amr626,VR camera tips,2,0.75,3,2024-02-09 15:50:01,2,0,5
282,1ammcvp,Should I upgrade from the index and what to.,4,0.75,15,2024-02-09 11:48:07,5,1,20
283,1amvyg0,ASUS RT-AX86U - good pick for Quest 3?,1,0.6,5,2024-02-09 19:10:27,1,0,6
284,1am3s4v,Just found my old WMR headset,79,0.94,21,2024-02-08 19:21:53,84,5,105
285,1amv8dn,"Do apps like these exist? Superman vision, Method of Loci in VR, VR novels",1,0.67,5,2024-02-09 18:39:19,1,0,6
286,1amn5d0,Could Immersed become the ultimate spatial computing tool by implementing this feature?,4,0.6,19,2024-02-09 12:33:47,6,2,25
287,1amlls9,Number of trackers for FBT,3,0.81,5,2024-02-09 10:59:23,3,0,8
288,1amu4ko,Post-HL:A recovery recommendations,1,0.56,25,2024-02-09 17:52:48,1,0,26
289,1am87z9,Do you prefer VR games over flatscreen games?,27,0.86,73,2024-02-08 22:29:10,31,4,104
290,1an4dt8,Vision Pro purchases?,0,0.33,14,2024-02-10 01:24:06,0,0,14
291,1an2kit,Palworld in VR is so sick,0,0.3,1,2024-02-09 23:58:53,0,0,1
292,1amlrv6,Vampire the Masquerade: Justice won't respond to my button inputs,1,0.57,3,2024-02-09 11:10:02,1,0,4
293,1amdz04,Basking in his treasure hoard lol.( A fan submitted this! ) Squid Smack is FREE on App Lab! Made by my husband and me. Thank you to all of you who have joined and made it a great community!,8,0.79,2,2024-02-09 02:59:04,10,2,12
294,1aml5va,"Virtual Desktop in ""Tile Mode"" Quest 3",2,0.75,3,2024-02-09 10:27:26,2,0,5
295,1amz9yk,What is the pricing strategy for virtual reality technology in aircraft maintenance education in a startup company?,0,0.33,3,2024-02-09 21:32:48,0,0,3
296,1am0olw,Bigscreen Beyond is now shipping internationally!,39,0.85,20,2024-02-08 17:12:27,45,6,65
297,1ammzib,Uevr palworld profile,1,0.55,2,2024-02-09 12:24:22,1,0,3
298,1am4w0d,Legendary Tales Review (9.7/10),19,0.91,1,2024-02-08 20:08:04,20,1,21
299,1amm4tt,Virtual Reality (VR) Arcades in Los Angeles: Immersive Entertainment Takes Center Stage,1,1.0,0,2024-02-09 11:33:35,1,0,1
300,1alwspl,"After big delays and a troubled launch, Nofio now refuses refund requests",50,0.93,35,2024-02-08 14:21:41,53,3,88
301,1am8nfc,Steam Next Fest Returns With New PC VR Demos This February,10,0.92,1,2024-02-08 22:47:48,10,0,11
302,1amb5si,Use Apple vision pro Disney plus environments on the Metaquest 3/equivlant,7,0.7,8,2024-02-09 00:41:50,10,3,18
303,1am4u06,ShadowMRboxing on the beach,15,0.74,1,2024-02-08 20:05:46,20,5,21
304,1amktkl,Quest 3 Prescription Lenses in Canada,0,0.5,3,2024-02-09 10:02:36,0,0,3
305,1amd4w0,Apple Vision Pro introduced me to Meta Quest 3.,4,0.62,13,2024-02-09 02:17:00,6,2,19
306,1amxr44,Just how close are we to full dive vr technology?,0,0.33,22,2024-02-09 20:27:20,0,0,22
307,1amc603,Does using a long Ethernet cable add latency?,4,0.84,17,2024-02-09 01:29:39,4,0,21
308,1amc20p,Should I upgrade from the original oculus rift?,4,0.83,6,2024-02-09 01:24:24,4,0,10
309,1an0ax4,Sam Altman on the vision pro.,0,0.43,45,2024-02-09 22:17:47,0,0,45
310,1am7rix,Dead Hook: Shaking the Depths of Hell on Steam,5,0.7,1,2024-02-08 22:09:44,7,2,8
311,1alp51g,"""I am shocked to say this, but Meta is on the right track (compared to Apple Vision)""",102,0.59,217,2024-02-08 06:16:36,172,70,389
312,1amtynd,"Apple Vision Pro: In the land of the two-eyed people, the one-eyed man saves $3,499",0,0.38,9,2024-02-09 17:45:46,0,0,9
313,1am9q1e,Albatroz DEMO | praydog UEVR |,3,0.67,0,2024-02-08 23:35:15,4,1,4
314,1amidf9,How to launch VR games without Steam VR but through Virtual Desktop?,1,0.6,4,2024-02-09 07:06:22,1,0,5
315,1am585n,Synth Riders on Apple Vision Pro,9,0.69,3,2024-02-08 20:22:14,13,4,16
316,1am2cqr,How to throw very far in Superhot VR?,9,0.92,8,2024-02-08 18:22:00,9,0,17
317,1amhddv,We might be having a bit too much fun with our new can opening mechanics..,2,0.6,0,2024-02-09 06:04:18,3,1,3
318,1am9gr6,VR in the SF Bay Area (and elsewhere)?,3,1.0,0,2024-02-08 23:23:42,3,0,3
319,1al558b,Someone walking with a Vision Pro and gets hit with a black mirror like experience,1095,0.93,210,2024-02-07 15:12:06,1177,82,1387
320,1ampozk,Anyone else feel iffy about Vision Pro being worn in public?,0,0.36,39,2024-02-09 14:44:06,0,0,39
321,1al9h0e,I think this goes a long way to explain why VR enthusiasts don't like the AVP,592,0.76,337,2024-02-07 18:12:19,778,186,1115
322,1alxtwo,It's finally here! We've just hit a big milestone with the release of our announcement trailer. Thank you to everyone from this community who has followed our puzzle adventure project so far. This is ⛵ EPYKA VR.,10,0.92,1,2024-02-08 15:09:18,10,0,11
323,1amerjg,Fallout VR controller bug.,1,1.0,1,2024-02-09 03:39:06,1,0,2
324,1amdcba,How good of a PC is needed for Quest 3 + PCVR?,0,0.5,8,2024-02-09 02:27:03,0,0,8
325,1am80y2,Looking to upgrade from Index,2,1.0,5,2024-02-08 22:20:40,2,0,7
326,1am1tfj,Gotham City at High Speed Will Blow You Away!,4,0.75,0,2024-02-08 18:00:03,5,1,5
327,1aluhfw,Ghosts of Tabor Launch Interview with Scott Albright - CEO and Creator of Ghosts of Tabor (Ruff Talk VR Podcast),12,0.87,3,2024-02-08 12:21:56,13,1,16
328,1ambwrl,What Happens After Mixed Reality Is Gone?,1,0.57,8,2024-02-09 01:17:25,1,0,9
329,1am354j,v1.13.7 - NOCK 2024 Evolve,3,0.67,0,2024-02-08 18:55:33,4,1,4
330,1alac2y,The Vision Pro Makes me sad..,251,0.79,248,2024-02-07 18:48:00,317,66,565
331,1am28hl,Question about dedicated routers for PCVR…,3,0.71,10,2024-02-08 18:17:13,4,1,14
332,1aljf49,"Been using VR since 2017, just did the Apple Vision Pro demo and was mostly blown away.",62,0.74,42,2024-02-08 01:16:00,83,21,125
333,1alz7w4,I have the Quest 3 and Xreal Air 2. I have practical uses for the extra features and portability of the Air 2 Ultra with its hand tracking and such. Is there any other optical passthrough alternative in that form factor?,4,0.7,0,2024-02-08 16:10:48,5,1,5
334,1am4lm0,OFFROAD MotorBike VR on SteamVR (Now Available),3,0.67,2,2024-02-08 19:56:23,4,1,6
335,1al8evu,"Brad Lynch: with Vision Pro, XR has ""finally hit the threshold"" to completely replace his external monitor for daily computing",227,0.79,200,2024-02-07 17:29:23,287,60,487
336,1am8rtw,"I want to get a new headset, which one?",1,0.57,8,2024-02-08 22:53:06,1,0,9
337,1alfzx5,Virtual Desktop & iVRy Both Building For Apple Vision Pro,86,0.89,62,2024-02-07 22:42:42,96,10,158
338,1alrb5t,Haptic Mixed Reality Chess - an innovative new approach to seamlessly fuse reality and virtuality,14,0.94,1,2024-02-08 08:46:58,14,0,15
339,1amii8y,Apple Vision Pro - Skiing,0,0.14,6,2024-02-09 07:15:47,0,0,6
340,1alvudm,A vr game im making,5,1.0,6,2024-02-08 13:35:34,5,0,11
341,1am7vc5,How to explain controls and menus to the tech illiterate,1,1.0,0,2024-02-08 22:14:08,1,0,1
342,1am6m6v,Youtube tv?,1,0.67,1,2024-02-08 21:20:54,1,0,2
343,1am6crb,Similar apps for meditation?,1,0.67,1,2024-02-08 21:09:58,1,0,2
344,1alxe26,Lifespan of Vision Pro OLED Displays?,2,0.56,32,2024-02-08 14:49:24,3,1,35
345,1alx4qk,"Which VR headset offers the best shared space experience, from gaming to movies and maybe even productivity?",3,0.71,4,2024-02-08 14:37:12,4,1,8
346,1alwymf,"I've made a relaxing 180° VR Animation, what do you think?",2,0.63,2,2024-02-08 14:29:27,3,1,5
347,1alysnx,uevr injection with virtual desktop ?,2,1.0,2,2024-02-08 15:52:13,2,0,4
348,1ami3e9,Could Metro Awakening Throw off HL:Alyx?,0,0.31,29,2024-02-09 06:48:55,0,0,29
349,1am3ihc,Need serious advice on setting up my Pico 4!!!,1,0.67,3,2024-02-08 19:10:46,1,0,4
350,1alxj3r,AR will normalize strange behavior in public,1,0.52,4,2024-02-08 14:55:44,1,0,5
351,1alndkd,Kat walk c2+ $500,13,0.82,18,2024-02-08 04:34:37,15,2,33
352,1alx1q0,Worth Upgrading from a quest 2 to a Pico 4 for PCVR?,3,0.71,9,2024-02-08 14:33:24,4,1,13
353,1alox1r,PositronX | praydog UEVR | 6DOF,10,0.92,0,2024-02-08 06:02:56,10,0,10
354,1al9le1,So it took the AVP,80,0.83,127,2024-02-07 18:17:22,96,16,223
355,1alfv4l,"Working out the kinks of teaching in VR. Positioning the virtual people is important, as is introducing one model at a time before things get crowded. Think this is gonna be pretty awesome.",34,0.9,8,2024-02-07 22:37:18,37,3,45
356,1alrd7w,Augmented vision?,5,0.73,12,2024-02-08 08:51:02,6,1,18
357,1am90tn,"Apple Reviewers are so oblivious: ""first device of its kind"" , ""no-one has ever seen these in public""",0,0.46,11,2024-02-08 23:03:59,0,0,11
358,1alcdxg,"I've just released Update 57 for cyubeVR on Steam! I've been working full-time on cyubeVR for over 8 years by now, and it's still going strong :) This update adds localization into many languages (including Klingon), a ""Seated Mode"", significant CPU/GPU/RAM optimizations and many other improvements!",44,0.97,14,2024-02-07 20:12:53,45,1,59
359,1alr90o,Effects of Augmented Reality on the Brain,5,0.69,9,2024-02-08 08:42:38,7,2,16
360,1al0x7z,STAR WARS: Squadrons (AAA VR) 95% discount on Steam right now,197,0.93,111,2024-02-07 11:34:52,211,14,322
361,1algx4a,PSVR2 exclusive “C-Smash VRS” Announced for Meta Quest 2 & 3 & PICO 4,23,0.96,3,2024-02-07 23:21:18,23,0,26
362,1almv3h,I want to get my friend into VR fitness and I need help finding the right way to do it,8,0.91,8,2024-02-08 04:07:02,8,0,16
363,1al7879,DeoVR coming to Apple Vision Pro in March,63,0.85,24,2024-02-07 16:41:07,74,11,98
364,1am9viv,"My AVP demo impressions: Very uncomfy, WTH is the purpose of this device's existence?",0,0.44,12,2024-02-08 23:42:05,0,0,12
365,1ambqu6,"Virtual Desktop: ""USE A CAT5 CABLE !!!"" well, if you don't have a wifi adapter on your pc you can't even SET UP quest air link at all!",0,0.21,4,2024-02-09 01:09:42,0,0,4
366,1alvmcc,Imagine a world where all movies are filmed with VR in mind,1,0.56,8,2024-02-08 13:24:07,1,0,9
367,1aln1ax,Any good wild west vr games with boneworks type gameplay?????,4,0.83,3,2024-02-08 04:16:05,4,0,7
368,1alomk7,"Mask-mic for VR to prevent voice leaking outside of room? (Also, general soundproofing setup advice?)",3,1.0,1,2024-02-08 05:46:11,3,0,4
369,1al36h9,I haven’t owned a headset since the first Vive. I just came back from demoing the AVP and I’ve fallen in love again,48,0.66,169,2024-02-07 13:41:42,72,24,241
370,1al5k55,The Verge: Ifixit 2nd teardown reveals display tech inside Vision Pro,32,0.77,27,2024-02-07 15:30:27,41,9,68
371,1alall2,These angry red guys won't take victory away from me 😈 Sky Climb is now Available on App Lab!,14,0.79,1,2024-02-07 18:58:54,17,3,18
372,1alxntx,No one has demoed SteamVR Lighthouse Tracked Vision Pro?,0,0.3,7,2024-02-08 15:01:43,0,0,7
373,1al07yf,"We've just released a new Beta Demo for Escape Simulator VR, and we need some feedback",45,0.93,20,2024-02-07 10:48:06,48,3,68
374,1akpv82,First commercial industry use case ?,281,0.82,183,2024-02-07 00:43:48,342,61,525
375,1al2t70,Zenith: Infinite Realms is looking for testers.,27,0.97,0,2024-02-07 13:23:05,27,0,27
376,1allg9w,Escape Robot Attack Experience | Car Destruction | UFO,3,0.71,0,2024-02-08 02:54:10,4,1,4
377,1al80d7,We're close to launching the Quest versions of Tiger Blade and are looking for some peeps that want to go fast!,11,0.92,4,2024-02-07 17:12:59,11,0,15
378,1akt609,Someone created a prototype app for blender to work with 3d inside Vision Pro . Wow,129,0.9,19,2024-02-07 03:21:27,143,14,162
379,1akqdro,Developer codes and demos Vision Pro app live inside Vision Pro,150,0.85,45,2024-02-07 01:07:52,176,26,221
380,1al2och,Latest VR 180 & 360 cameras: new and coming soon,15,0.9,8,2024-02-07 13:16:01,16,1,24
381,1akph7x,Vision Pro users reporting persona quality noticeably improved in visionOS 1.1 update,158,0.76,95,2024-02-07 00:25:48,207,49,302
382,1alpoqf,Meta Quest 3 or PlayStation VR2?,0,0.45,19,2024-02-08 06:52:08,0,0,19
383,1al5m1u,PICO 4 good alternative to quest 2?,9,0.8,48,2024-02-07 15:32:51,11,2,59
384,1alytuy,"Hi, I'm a Quest. And I'm a Vision Pro.",0,0.39,14,2024-02-08 15:53:45,0,0,14
385,1alf6gv,Anyone Got a good guide on fallout 4 vr mods?,2,0.75,3,2024-02-07 22:08:57,2,0,5
386,1akhiiw,Surgical VR App on Vision Pro looks incredible,286,0.88,46,2024-02-06 19:00:49,325,39,371
387,1alj5kv,Is the ALVR on Vision Pro thing available to anyone ?,2,0.62,15,2024-02-08 01:03:27,3,1,18
388,1ala8v1,Genotype - Only 24 more hours to go... We hope to see you at the South Pole! 🐧🐙,4,0.75,13,2024-02-07 18:44:16,5,1,18
389,1alde9a,3 virtual monitors + Nvidia surround...?,2,0.75,2,2024-02-07 20:55:08,2,0,4
390,1ali92s,Help me with VR Gunstocks Market Research!,1,0.67,0,2024-02-08 00:19:00,1,0,1
391,1ali0um,Website for beta testing games?,1,1.0,0,2024-02-08 00:08:50,1,0,1
392,1alhj6f,I created Survivor in VR,0,0.5,1,2024-02-07 23:47:32,0,0,1
393,1al8w2e,"Windows ""Device Disconnect"" Sound Plays Every Few Moments While NaLo Is Open (Cross-Post)",3,1.0,2,2024-02-07 17:48:42,3,0,5
394,1al1sfa,is there any app that lets me view apps while they stay in front of me in passtrough instead of stationary when im walking around,8,0.83,3,2024-02-07 12:27:52,9,1,12
395,1alh9ec,How much better is the passthrough on the AVP compared to the Quest 3?,1,0.54,17,2024-02-07 23:35:43,1,0,18
396,1akdhky,Apple Vision Pro Demonstrated Working on SteamVR via ALVR,311,0.94,147,2024-02-06 16:15:50,330,19,477
397,1alba9h,Reasonable upgrade path from OG Vive,2,0.75,15,2024-02-07 19:27:04,2,0,17
398,1alb4a6,Vr for beginner,2,1.0,8,2024-02-07 19:20:04,2,0,10
399,1algha1,Extreme Nearsighted vs Meta Quest 3,1,0.6,8,2024-02-07 23:02:52,1,0,9
400,1alg2du,Would Most People Not Care for VR if games were only Single Player since I keep seeing the comments requesting Multiplayer for all games that don't have it?,0,0.44,29,2024-02-07 22:45:28,0,0,29
401,1alahdi,Comedy Tonight in Horizons! Wed Feb 7th 9pm EST,2,0.63,2,2024-02-07 18:53:58,3,1,5
402,1aluhgt,Is Netflix Trolling Apple? Or are they actually curious about the vision pro?,0,0.27,35,2024-02-08 12:21:59,0,0,35
403,1al9sjh,Purchase advice: watching movies while travelling,2,1.0,7,2024-02-07 18:25:21,2,0,9
404,1alcv2p,Haptic Suits,1,1.0,3,2024-02-07 20:32:28,1,0,4
405,1alytog,Is this seriously the current state of VR?,0,0.09,35,2024-02-08 15:53:30,0,0,35
406,1alqrxe,Vr for what?,0,0.2,36,2024-02-08 08:07:37,0,0,36
407,1akwj6h,Anyone remember this? Probably more relevant than ever. - HYPER-REALITY by Keiichi Matsuda,11,0.77,9,2024-02-07 06:25:29,14,3,23
408,1albq28,Question about whether I should by a 3060/3060 TI or a HP Reverb for PC VR.,0,0.5,10,2024-02-07 19:45:30,0,0,10
409,1akhz0t,Had a heated debate with my wife,91,0.77,307,2024-02-06 19:19:14,118,27,425
410,1al65k4,Looking to connect with someone who works for a VR company.,2,0.75,0,2024-02-07 15:56:47,2,0,2
411,1alatsq,Any free multiplayer horror games?,1,0.67,2,2024-02-07 19:08:05,1,0,3
412,1alao14,"Game req: 4 player, crossplay enabled, and noob friendly",1,0.67,3,2024-02-07 19:01:30,1,0,4
413,1alanvk,Quest 3 Stuttering Above 20mbps in Virtual Desktop,0,0.5,7,2024-02-07 19:01:21,0,0,7
414,1akv9j0,"why do headsets, specifically AIO's, not put some of the hardware behind your head with the strap.",12,0.72,47,2024-02-07 05:11:12,16,4,63
415,1akkbje,I am making a VR mod for We Were Here!,47,0.95,11,2024-02-06 20:53:28,49,2,60
416,1al8xav,RED DEAD REDEMPTION 2 IN VIRTUAL REALITY. Played on the Quest 2 & 3. FREE MOD. 2024 Setup & Gameplay. Unfortunately a PC or Laptop is required to play RDR2 in VR.,0,0.44,0,2024-02-07 17:50:04,0,0,0
417,1al8k6l,Checkout my free physics-based FPS using gorilla tag locomotion!,1,0.6,2,2024-02-07 17:35:13,1,0,3
418,1al7pmu,Use M/KB that is connected to PC on Virtual Desktop,0,0.5,2,2024-02-07 17:01:08,0,0,2
419,1akm5ib,"Inspired by u/grimdar, I decided to make a more native looking Solo Band top strap adapter for the Vision Pro that I'm calling the SoloTop! Currently battle testing an engineering grade resin print and will post real pictures soon!",33,0.82,11,2024-02-06 22:05:47,40,7,51
420,1ak4gr1,The $800 laminated glass on The Apple Vision Pro is covered with plastic!,441,0.83,288,2024-02-06 07:42:47,531,90,819
421,1al6szj,Best PCVR headset for €300-€400,0,0.5,2,2024-02-07 16:23:39,0,0,2
422,1al69l8,What's the best VR headset to buy for a Complete VR noob?,2,0.62,25,2024-02-07 16:01:27,3,1,28
423,1al5z5c,USB 3.2 Gen 1 vs USB 3.2 Gen 2 vs USB 3.2 Gen 2x2 for PICO 4,1,0.67,3,2024-02-07 15:48:51,1,0,4
424,1ak5tlh,The Unreal Engine 5.1 Biomes are best VR visuals ive seen,237,0.81,109,2024-02-06 09:23:20,292,55,401
425,1akn9oa,AVP reviews by actual VR youtubers?,19,0.73,31,2024-02-06 22:51:16,26,7,57
426,1al503m,2024 Headset recommendations for RTX 4090?,0,0.5,8,2024-02-07 15:05:47,0,0,8
427,1al0eet,Simple Planes On Meta Quest 2 is a Real Treat,2,0.6,1,2024-02-07 11:00:43,3,1,4
428,1al4dmt,F1 races weekend in VR,0,0.5,3,2024-02-07 14:38:05,0,0,3
429,1akhw0x,Switched from Quest 3 to HP Revergb G2 for PCVR,31,0.71,150,2024-02-06 19:15:53,43,12,193
430,1alkagr,Here is T-Pain walking around the mall wearing a VR headset,0,0.29,1,2024-02-08 01:58:06,0,0,1
431,1akdg9v,"Our first-person stealth game Vampire the Masquerade: Justice just launched on SteamVR, with a 20% discount!",53,0.95,28,2024-02-06 16:14:19,55,2,83
432,1al26lc,ALVR working on Vision Pro,1,0.54,1,2024-02-07 12:49:45,1,0,2
433,1akgtxo,Museum Rampage for Alyx,27,0.88,10,2024-02-06 18:33:32,30,3,40
434,1ak9plt,MSFS VR. Stunningly beautiful Norway. Flying near Bronnoysund. Gradually crawling up north in my Cape2Pole journey project (currently using a Quest3 over Virtual Desktop on a 3700X/3080RTX pc),57,0.97,6,2024-02-06 13:26:39,58,1,64
435,1alfh8e,Apple vision going on sale for 2 - 3x sale price on eBay,0,0.33,8,2024-02-07 22:21:24,0,0,8
436,1akp7eu,I just (sort of) applied to teach at a virtual reality charter school. We are living in the future.,6,1.0,7,2024-02-07 00:13:45,6,0,13
437,1akzeqj,Best VR for watching NBA and movies on web browser?,1,0.6,2,2024-02-07 09:50:04,1,0,3
438,1akyy29,"Where can you find, and How do you play vision pro and iphone 3d videos on quest 3?",1,0.55,3,2024-02-07 09:14:48,1,0,4
439,1aky3t7,"New, beautiful environments to watch movies.",1,0.67,6,2024-02-07 08:12:06,1,0,7
440,1ajt48b,52-year-old CEO Elon Musk with his profound perspective on virtual reality devices,486,0.78,358,2024-02-05 22:08:35,623,137,981
441,1ald2ns,Why are people so hyped up about the apple vision pro?,0,0.31,27,2024-02-07 20:41:31,0,0,27
442,1ak8lut,Steam Next Fest is live with various demos for upcoming PCVR games (list inside),32,0.94,11,2024-02-06 12:28:04,34,2,45
443,1akwwdq,"Need more info about this, can anyone help?",1,1.0,1,2024-02-07 06:49:08,1,0,2
444,1akh3tf,Pacific Drive | praydog UEVR |,10,0.86,2,2024-02-06 18:44:34,11,1,13
445,1al3qr2,iFixit: Vision Pro Teardown - Part 2,0,0.33,1,2024-02-07 14:08:35,0,0,1
446,1akjau5,Offroad Motorbike On AppLab (Meta Store) Gameplay,6,0.64,1,2024-02-06 20:12:51,9,3,10
447,1akrlke,Whats the best budget for pc vr (Quest 3),2,0.75,5,2024-02-07 02:04:57,2,0,7
448,1akv0fw,Aleksey Leonov Within VR,0,0.5,0,2024-02-07 04:58:03,0,0,0
449,1akcx93,vr glasses changed vr for me,12,0.87,8,2024-02-06 15:51:10,13,1,21
450,1akugfz,Psvr2 or quest 3,1,0.6,19,2024-02-07 04:28:42,1,0,20
451,1al5noc,Meta Quest is 2 Much,0,0.27,20,2024-02-07 15:34:54,0,0,20
452,1aktsbv,Best untethered for online VR?,0,0.4,4,2024-02-07 03:53:30,0,0,4
453,1ajvi1u,Tried AVP demo today,170,0.83,188,2024-02-05 23:47:56,204,34,392
454,1akt8aa,Can virtual reality be used to improve a language?,1,0.6,3,2024-02-07 03:24:39,1,0,4
455,1ajidra,This guy LOVES the new AVP!,775,0.9,145,2024-02-05 14:55:04,861,86,1006
456,1ak11kz,My Final review and rating of my Vision Pro,59,0.75,79,2024-02-06 04:14:53,78,19,157
457,1akgk4q,Are vr treadmills worth it,5,0.78,24,2024-02-06 18:22:30,6,1,30
458,1akcuvb,We released Crumbling last month - A roguelike that let's you fight with an Action Figure in your hand! It's a new take on how to do 3rd-person in VR.,7,1.0,0,2024-02-06 15:48:16,7,0,7
459,1akcut6,"Learn how to brew potions in my alchemy game, Alchem It!",7,0.82,1,2024-02-06 15:48:11,8,1,9
460,1aki4dk,Contractors Showdown Might Be The BEST VR Battle Royale in VR,2,0.67,0,2024-02-06 19:25:15,2,0,2
461,1akav05,If you could have any game get the UEVR treatment - what would it be?,6,0.81,21,2024-02-06 14:21:11,7,1,28
462,1akq3qi,New vr game idea called EAT IT! (this is only a idea concept.),0,0.5,3,2024-02-07 00:54:52,0,0,3
463,1akgtj1,Beautiful and relaxing VR equivalent of terraria or trove?,3,1.0,1,2024-02-06 18:33:04,3,0,4
464,1akwgew,is this a good recreation of how the quest 3’s glare looks?,0,0.36,12,2024-02-07 06:20:41,0,0,12
465,1ajyfy4,Be gentle with the Apple Vision Pro - ITS PLASTIC! - JerryRigEverything,58,0.7,59,2024-02-06 02:02:40,82,24,141
466,1ako8hd,Sharing each-others space.,1,1.0,2,2024-02-06 23:32:01,1,0,3
467,1ako4ev,Failed To Render Comedy Club,1,0.67,0,2024-02-06 23:27:14,1,0,1
468,1aknqey,Best headset to pair with 4090?,0,0.43,37,2024-02-06 23:10:30,0,0,37
469,1aked9l,Best way to attach vive tracker to quest 3 headset?,4,0.83,5,2024-02-06 16:52:22,4,0,9
470,1akmuks,Amazing experience with teleported Scotland,1,1.0,2,2024-02-06 22:34:18,1,0,3
471,1akmsip,What am I doing wrong?,0,0.5,12,2024-02-06 22:31:57,0,0,12
472,1akm4gl,Does anyone else have itchy legs when playing vr?,0,0.5,10,2024-02-06 22:04:35,0,0,10
473,1akm3ml,Zeiss wipes on Apple Vision Pro,1,0.6,2,2024-02-06 22:03:40,1,0,3
474,1akxqf0,In today's video I forced 3 of the DUMBEST VR YouTubers to play Rec Room Lethal Company...,0,0.11,2,2024-02-07 07:45:18,0,0,2
475,1akllwp,How do I switch between racing sim rig and regular vr apps?,0,0.5,3,2024-02-06 21:44:06,0,0,3
